ticker,date,title,distributor,gross,percent_yd,percent_lw,theaters,per_theater,total_gross,days_in_release,parent company,release_date,year,title_key,tmdb_id,popularity,weekday,release_month,release_weekday,is_weekend,imdb_id,original_language,status,budget,revenue,adult,overview,runtime,vote_average,vote_count,origin_country,spoken_languages,genre_ids,genre_names,production_company_ids,production_company_names,belongs_to_collection,gross_per_theater,omdb_title,omdb_year,omdb_rated,omdb_released,omdb_runtime,omdb_genre,omdb_director,omdb_writer,omdb_actors,omdb_plot,omdb_language,omdb_country,omdb_awards,omdb_poster,omdb_metascore,omdb_imdbrating,omdb_imdbvotes,omdb_boxoffice,omdb_production,omdb_rating_internetmoviedatabase,omdb_rating_rottentomatoes,omdb_rating_metacritic
Private,2025-11-06,Anniversary,Roadside Att…,23223,-0.5,-0.43,809.0,29.0,530320,9,Roadside Attractions,2025-10-28,2025,anniversary,210832,0.0773,3,10,1,0,tt0224619,en,Released,0.0,0.0,False,Computer animated short film created to commemorate the National Film Board of Canada's 50th anniversary.,12.0,0.0,0.0,US,,16,Animation,10473,ONF | NFB,,28.70580964153276,,,,,,,,,,,,,,,,,,,,,,
Private,2025-11-07,Die My Love,MUBI,1000000,0.0,0.0,1983.0,504.0,1000000,1,MUBI,2025-11-06,2025,die my love,1033148,8.2564,4,11,3,1,tt9362736,en,Released,20000000.0,2610583.0,False,"Grace, a writer and young mother, is slowly slipping into madness. Locked away in an old house in Montana, her increasingly agitated and erratic behaviour leaves her companion, Jackson, worried and helpless.",119.0,6.9,15.0,US,English,18,Drama,"117188, 23243, 33681","Excellent Cadaver, Sikelia Productions, Black Label Media",,504.2864346949067,Die My Love,2025,R,07 Nov 2025,119 min,"Drama, Thriller",Lynne Ramsay,"Enda Walsh, Lynne Ramsay, Alice Birch","Jennifer Lawrence, Robert Pattinson, Sissy Spacek","Grace, a writer and young mother, is slowly slipping into madness. Locked away in an old house in and around Montana, we see her acting increasingly agitated and erratic, leaving her companion, Jackson, increasingly worried and he...",English,"United Kingdom, Canada, United States",10 nominations total,https://m.media-amazon.com/images/M/MV5BYjc5OWZlZmYtMTg3Yy00YzFmLTg0YTgtNjVjN2M2ZWJjOWM1XkEyXkFqcGc@._V1_SX300.jpg,72.0,6.6,"9,529","$4,884,888",,6.6/10,,72/100
6758,2025-11-10,Nuremberg,Sony Picture…,470000,-0.52,0.0,1802.0,261.0,4353294,4,Sony Corporation,2025-11-06,2025,nuremberg,934121,0.2473,0,11,3,0,,en,Released,0.0,0.0,False,"This film essentially consists of a reassembly of the subjects made by the press filmed during the trial. Illustrated with numerous archive images giving a history of Nazi crimes, it summarizes the trial in which most of the Nazi leaders were tried. Ignoring or almost ignoring the role of the United States, the United Kingdom and the Soviet Union, he gives pride of place to that of France.",19.0,7.5,1.0,US,English,99,Documentary,,,,260.82130965593785,,,,,,,,,,,,,,,,,,,,,,
DIS,2025-11-10,Predator: Badlands,20th Century…,3480723,-0.64,0.0,3725.0,934.0,43497576,4,The Walt Disney Company,2025-11-06,2025,predator: badlands,1242898,28.1537,0,11,3,0,tt31227572,en,Released,105000000.0,80000000.0,False,"Cast out from his clan, a young Predator finds an unlikely ally in a damaged android and embarks on a treacherous journey in search of the ultimate adversary.",107.0,7.174,215.0,US,English,"28, 878, 12","Action, Science Fiction, Adventure","127928, 840, 1302, 185309, 22213","20th Century Studios, Lawrence Gordon Productions, Davis Entertainment, Toberoff Productions, TSG Entertainment",Predator Collection,934.4222818791948,Predator: Badlands,2025,PG-13,07 Nov 2025,107 min,"Action, Adventure, Sci-Fi",Dan Trachtenberg,"Patrick Aison, Jim Thomas, John Thomas","Elle Fanning, Dimitrius Schuster-Koloamatangi",A young Predator outcast from his clan finds an unlikely ally on his journey in search of the ultimate adversary.,English,"United States, Australia, New Zealand, Canada",,https://m.media-amazon.com/images/M/MV5BNTdjZGUxMTItNjRkNS00N2VhLWE4MjMtMjVhODMwMGIxNjUwXkEyXkFqcGc@._V1_SX300.jpg,71.0,7.6,"18,100","$40,000,000",,7.6/10,85%,71/100
Private,2025-11-09,Sentimental Value,Neon,48000,-0.08,0.0,4.0,12000.0,200000,3,30WEST,2025-11-06,2025,sentimental value,1105422,1.5149,6,11,3,1,,en,Released,0.0,0.0,False,A group of coworkers buy a piano at a yard sale for a friend in need.,13.0,0.0,0.0,US,English,35,Comedy,,,,12000.0,,,,,,,,,,,,,,,,,,,,,,
Private,2025-11-10,Stitch Head,Briarcliff E…,80111,-0.7,-0.47,1605.0,50.0,3943550,13,Briarcliff Entertainmen,2025-10-28,2025,stitch head,1214130,4.137,0,10,1,0,tt26720001,en,Released,34800000.0,3455841.0,False,"Stitch Head was the first creature brought to 'almost life' by mad professor Erasmus. In the years since, he’s become nursemaid to the master’s ever-growing menagerie of neglected creatures, tasked with teaching them to suppress their 'inner monster' and hide out in the castle — away from prying eyes and itchy pitchfork fingers, of the village mob in the valley below. But when grubby circus impresario Fulbert Freakfinder arrives offering Stitch Head a starring role in his freak show, our hero is tempted by the promise of love and acceptance.",92.0,6.6,5.0,"FR, DE, LU, GB",English,"16, 12, 10751, 35","Animation, Adventure, Family, Comedy","150709, 229487, 142311, 56913, 50164, 191, 162898, 72281, 856","GFM Animation, Rabbits Black, Aniventure, GRINGO films GmbH, Fabrique d'images, Senator Film, Traumhaus Studios, Assemblage Entertainment, Wild Bunch",,49.91339563862928,Stitch Head,2025,PG,29 Oct 2025,89 min,"Animation, Comedy, Family",Steve Hudson,"Guy Bass, Steve Hudson","Asa Butterfield, Joel Fry, Alison Steadman","Follows Stitch Head, a small creature awoken by a Mad Professor in a castle to protect the professor's other creations from the townspeople of Grubbers Nubbin.",English,"United Kingdom, France, Germany, Luxembourg",2 nominations total,https://m.media-amazon.com/images/M/MV5BYWUwNWE1YjctMDYyOC00YmJjLWFkZTMtYzhjNmI3NTI4ZTMxXkEyXkFqcGc@._V1_SX300.jpg,,6.1,182,,,6.1/10,69%,
