Title,Year,Rated,Released,Runtime,Genre,Director,Writer,Actors,Plot,Language,Country,Awards,Poster,Metascore,imdbRating,imdbVotes,imdbID,Type,DVD,BoxOffice,Production,Website,Response,Rating_InternetMovieDatabase,Rating_Metacritic,Error,Rating_RottenTomatoes,Season,Episode,seriesID,totalSeasons
The Last Supper,1995,R,05 Apr 1996,92 min,"Comedy, Crime, Drama",Stacy Title,Dan Rosen,"Cameron Diaz, Ron Eldard, Annabeth Gish",A group of idealistic but frustrated liberals succumb to the temptation of murdering right-wing pundits for their political beliefs.,English,United States,1 win & 1 nomination total,https://m.media-amazon.com/images/M/MV5BZDE3YzI1YTMtMDNmYy00MmUzLTkzYTYtMTkyMWUzYTEwM2I5XkEyXkFqcGc@._V1_SX300.jpg,N/A,6.7,"16,125",tt0113613,movie,N/A,"$459,749",N/A,N/A,True,6.7/10,,,61%,,,,
The Actor,2025,R,14 Mar 2025,98 min,"Crime, Drama, Mystery",Duke Johnson,"Stephen Cooney, Duke Johnson, Donald E. Westlake","André Holland, Gemma Chan, May Calamawy","When New York actor Paul Cole is beaten and left for dead in 1950s Ohio, he loses his memory and finds himself stranded in a mysterious small town where he struggles to get back home and reclaim what he's lost.",English,"United States, Hungary",N/A,https://m.media-amazon.com/images/M/MV5BMWM1OTQ3MjAtNDQzZC00ZDE3LWJkYWEtOTQxZTM0ZGM3YWNmXkEyXkFqcGc@._V1_SX300.jpg,62,5.7,487,tt14127944,movie,N/A,"$42,753",N/A,N/A,True,5.7/10,62/100,,78%,,,,
The Last Supper,1994,N/A,01 Nov 1996,96 min,Drama,Cynthia Roberts,"Greg Klymkiw, Hillar Liitoja, Cynthia Roberts","Daniel MacIvor, Ken McDougall, J.D. Nicholsen","Chris is a dancer dying of AIDS. He has chosen euthanasia to end his suffering. With the assistance of his lover Val and his doctor, he surrounds himself in his last hours with everything that made his life special and creates his...",English,Canada,1 win,https://m.media-amazon.com/images/M/MV5BNjZiMDM3NGQtNjdkMy00OTRkLWFiY2ItYmEzOWU1ZDhkMzEzXkEyXkFqcGdeQXVyMDM1MzIyMQ@@._V1_SX300.jpg,N/A,7.1,97,tt0110310,movie,N/A,N/A,N/A,N/A,True,7.1/10,,,,,,,
,,,,,,,,,,,,,,,,,,,,,,,False,,,Incorrect IMDb ID.,,,,,
,,,,,,,,,,,,,,,,,,,,,,,False,,,Incorrect IMDb ID.,,,,,
,,,,,,,,,,,,,,,,,,,,,,,False,,,Incorrect IMDb ID.,,,,,
The Last Supper,2025,PG-13,14 Mar 2025,114 min,"Drama, History",Mauro Borrelli,"Mauro Borrelli, John Collins","Robert Knepper, Jamie Ward, James Faulkner","Depicts events prior to a betrayal, as a group of disciples gather, unveiling secrets and underlying motives.",English,United States,N/A,https://m.media-amazon.com/images/M/MV5BMDBhYjBlYzctOTMyNC00NmMxLTk4YmMtMTU4Yjg3MzMwNjc1XkEyXkFqcGc@._V1_SX300.jpg,N/A,6.2,219,tt32461003,movie,N/A,"$3,769,374",N/A,N/A,True,6.2/10,,,,,,,
,,,,,,,,,,,,,,,,,,,,,,,False,,,Incorrect IMDb ID.,,,,,
,,,,,,,,,,,,,,,,,,,,,,,False,,,Incorrect IMDb ID.,,,,,
The Last Supper,2009,N/A,26 Jun 2009,14 min,"Short, Comedy",Angus Sampson,Angus Sampson,"Jack Charles, Leigh Whannell, Tony Martin","Set ten minutes before Jesus arrives at The Last Supper, 13 men at lunch fueled by wine and emotion. Satirising Man's hedonism and greed, 'The Last Supper' explores race and religion whilst re-imagining two of history's greatest b...","English, Mandarin",Australia,N/A,https://m.media-amazon.com/images/M/MV5BMTY1NDU2NzU1MF5BMl5BanBnXkFtZTcwMjEzNDY3Mg@@._V1_SX300.jpg,N/A,8.6,27,tt1441893,movie,N/A,N/A,N/A,N/A,True,8.6/10,,,,,,,
On Becoming a Guinea Fowl,2024,PG-13,04 Jul 2025,99 min,"Comedy, Drama",Rungano Nyoni,Rungano Nyoni,"Susan Chardy, Elizabeth Chisela, Roy Chisha","On an empty road in the middle of the night, Shula stumbles across the body of her uncle. As funeral proceedings begin around them, she and her cousins bring to light the buried secrets of their middle-class Zambian family.","English, Bemba","United Kingdom, Zambia, Ireland, United States",9 wins & 12 nominations total,https://m.media-amazon.com/images/M/MV5BMWU4ODUyOWYtMDdjOC00NzA1LWJmNDQtYjcxMWE1NDA3MGE2XkEyXkFqcGc@._V1_SX300.jpg,87,7.0,"1,554",tt32083311,movie,N/A,"$166,851",N/A,N/A,True,7.0/10,87/100,,100%,,,,
Rule Breakers,2025,PG,07 Mar 2025,120 min,Drama,Bill Guttentag,"Jason Brown, Bill Guttentag, Elaha Mahboob","Nikohl Boosheri, Ali Fazal, Phoebe Waller-Bridge","In a nation where educating girls is rebellion, a visionary woman sparks hope and opposition. Their courage ignites a movement that could transform their nation forever.",English,United States,2 wins total,https://m.media-amazon.com/images/M/MV5BZGYyN2RlYzAtZWVlYy00ZGQ3LWE5ZmYtYWM0ZTlhMmE4YzE5XkEyXkFqcGc@._V1_SX300.jpg,55,6.6,972,tt23398348,movie,N/A,"$2,969,825",N/A,N/A,True,6.6/10,55/100,,82%,,,,
,,,,,,,,,,,,,,,,,,,,,,,False,,,Incorrect IMDb ID.,,,,,
The Rule of Jenny Pen,2024,R,07 Mar 2025,104 min,"Horror, Mystery, Thriller",James Ashcroft,"Eli Kent, James Ashcroft, Owen Marshall","Geoffrey Rush, Nikki MacDonnell, Maaka Pohatu","Confined to a secluded rest home and trapped within his stroke-ridden body, a former Judge must stop an elderly psychopath who employs a child's puppet to abuse the home's residents with deadly consequences.",English,New Zealand,1 win & 6 nominations total,https://m.media-amazon.com/images/M/MV5BMTJiMzg2ODgtNDhhMi00YmE3LWI3ZmEtOGUwYjFlOTFjYTZmXkEyXkFqcGc@._V1_SX300.jpg,66,6.2,"9,226",tt6874690,movie,N/A,"$433,817",N/A,N/A,True,6.2/10,66/100,,71%,,,,
In the Lost Lands,2025,R,07 Mar 2025,101 min,"Action, Adventure, Fantasy",Paul W.S. Anderson,"Constantin Werner, Paul W.S. Anderson, George R.R. Martin","Milla Jovovich, Dave Bautista, Arly Jover","A queen sends the powerful and feared sorceress Gray Alys to the ghostly wilderness of the Lost Lands in search of a magical power, where the sorceress and her guide, the drifter Boyce, must outwit and outfight man and demon.",English,"Germany, United States, Switzerland",1 nomination total,https://m.media-amazon.com/images/M/MV5BOWYxYjEyYTUtY2FkZC00Y2QwLTk1ZjMtMTAyMTAyMzQ3MDZiXkEyXkFqcGc@._V1_SX300.jpg,41,4.7,"13,748",tt4419684,movie,N/A,"$1,870,305",N/A,N/A,True,4.7/10,41/100,,24%,,,,
Mickey 17,2025,R,07 Mar 2025,137 min,"Adventure, Comedy, Fantasy",Bong Joon Ho,"Bong Joon Ho, Edward Ashton","Robert Pattinson, Steven Yeun, Michael Monroe","During a human expedition to colonize space, Mickey 17, a so-called ""expendable"" employee, is sent to explore an ice planet.",English,"United States, South Korea",1 win & 5 nominations total,https://m.media-amazon.com/images/M/MV5BZGQwYmEzMzktYzBmMy00NmVmLTkyYTUtOTYyZjliZDNhZGVkXkEyXkFqcGc@._V1_SX300.jpg,72,6.7,"191,316",tt12299608,movie,N/A,"$46,047,147",N/A,N/A,True,6.7/10,72/100,,77%,,,,
My Dead Friend Zoe,2024,R,28 Feb 2025,103 min,"Comedy, Drama, War",Kyle Hausmann-Stokes,"Kyle Hausmann-Stokes, Cherish Chen, A.J. Bermudez","Sonequa Martin-Green, Natalie Morales, Ed Harris","Engaged in a mysterious relationship with her dead best friend from the Army, a female Afghanistan veteran comes head to head with her Vietnam vet grandfather at the family's ancestral lake house.",English,United States,7 wins & 1 nomination total,https://m.media-amazon.com/images/M/MV5BZGVmODBmMDItYjQxMi00ZDU5LWFhOWEtZGU4YzRkNzM1Nzg3XkEyXkFqcGc@._V1_SX300.jpg,75,6.5,"2,702",tt22022784,movie,N/A,"$1,250,703",N/A,N/A,True,6.5/10,75/100,,94%,,,,
Riff Raff,2024,R,28 Feb 2025,103 min,"Comedy, Crime",Dito Montiel,John Pollono,"Jennifer Coolidge, Ed Harris, Gabrielle Union",A former criminal's ordinary life is turned upside down when his old family shows up for a long-awaited reunion.,English,"United States, United Kingdom",N/A,https://m.media-amazon.com/images/M/MV5BN2FiYzNhNTItN2M4Mi00MDRjLTk2NTMtYmQxODk4ZTMzN2E5XkEyXkFqcGc@._V1_SX300.jpg,47,5.7,"6,389",tt27775403,movie,N/A,"$1,862,519",N/A,N/A,True,5.7/10,47/100,,55%,,,,
The Monkey,2025,R,21 Feb 2025,98 min,Horror,Osgood Perkins,"Osgood Perkins, Stephen King","Theo James, Tatiana Maslany, Christian Convery","When twin brothers Bill and Hal find their father's old monkey toy in the attic, a series of gruesome deaths start. The siblings decide to throw the toy away and move on with their lives, growing apart over the years.",English,"United States, United Kingdom, Canada",3 wins & 5 nominations total,https://m.media-amazon.com/images/M/MV5BNzZhMTc5MWUtOTE2MS00MjUwLTljYWEtYTk1ZmVjNzhmMzYzXkEyXkFqcGc@._V1_SX300.jpg,62,5.9,"81,685",tt27714946,movie,N/A,"$39,724,909",N/A,N/A,True,5.9/10,62/100,,77%,,,,
The Monkey,2021,N/A,30 May 2021,17 min,"Short, Adventure, Fantasy","Lorenzo Degl' Innocenti, Xosé Zapata","Ana Esperanza Villar Romarís, Xosé Zapata","Colm Meaney, Alex Brendemühl, Eduardo Araujo de Barros","In 1588, a castaway from the Spanish Armada, sent from Portugal by Philip II of Spain to conquer England, is captured on an Irish beach. There he is tried, declared guilty and hanged to death. All of this would be reasonable accor...","English, Spanish","Spain, Portugal",1 win & 5 nominations,https://m.media-amazon.com/images/M/MV5BM2E2MTkzYTMtNDIyNy00ZDI1LWFlNjQtZDUyYzZmZGNkZGU5XkEyXkFqcGc@._V1_SX300.jpg,N/A,N/A,49,tt13356010,movie,N/A,N/A,N/A,N/A,True,,,,,,,,
Ex-Husbands,2023,N/A,07 Jun 2024,98 min,"Comedy, Drama",Noah Pritzker,Noah Pritzker,"Griffin Dunne, Rosanna Arquette, Richard Benjamin","When Peter Pearce flies to Tulum, crashing his son Nick's bachelor party, Peter realizes he's not the only Pearce man in crisis.","English, Spanish","United States, Mexico",2 nominations,https://m.media-amazon.com/images/M/MV5BYjBiODE3YTctNmZmYy00ZWQ1LWI4ZjYtMTEyYjliZWQ0ZGFkXkEyXkFqcGc@._V1_SX300.jpg,N/A,N/A,309,tt21347764,movie,N/A,N/A,N/A,N/A,True,,,,76%,,,,
The Unbreakable Boy,2025,PG,21 Feb 2025,109 min,Drama,Jon Gunn,"Jon Gunn, Scott LeRette, Susy Flory","Zachary Levi, Meghann Fahy, Jacob Laval","A young boy with both a rare brittle-bone disease and autism transforms everyone around him with his joyous, funny, and life-affirming world view.",English,United States,1 win & 1 nomination total,https://m.media-amazon.com/images/M/MV5BYjYzN2MwNTItNmZkZS00YmEyLWIwYmQtNzAyYzQxZWVhMTBlXkEyXkFqcGc@._V1_SX300.jpg,35,5.7,"1,672",tt5181260,movie,N/A,"$6,443,813",N/A,N/A,True,5.7/10,35/100,,43%,,,,
The Monkey,2023,N/A,06 May 2023,N/A,Short,Spencer Sherry,Spencer Sherry,"Lilly Moran, Chris Gaunt, Courtland Jones","Based upon the story by Stephen King. After a near-fatal accident, soon-to-be father Pete Shelburn begins to suspect that his past has come back to haunt him. With his own father at death's door and his brother refusing to make am...",English,United States,N/A,https://m.media-amazon.com/images/M/MV5BNTY4ZThjYWYtYWU0Ny00MjhlLTllOGYtMmMwNWE3YzdiZjcxXkEyXkFqcGdeQXVyOTIzNjg5NDA@._V1_SX300.jpg,N/A,N/A,6,tt16452334,movie,N/A,N/A,N/A,N/A,True,,,,,,,,
Paddington in Peru,2024,PG,14 Feb 2025,106 min,"Adventure, Comedy, Family",Dougal Wilson,"Michael Bond, Paul King, Simon Farnaby","Hugh Bonneville, Emily Mortimer, Ben Whishaw","Paddington returns to Peru to visit his beloved Aunt Lucy, who now resides at the Home for Retired Bears. With the Brown family in tow, a thrilling adventure ensues when a mystery plunges them into an unexpected journey.","English, Spanish, French","United Kingdom, France, Japan, United States, Colombia",2 wins & 8 nominations total,https://m.media-amazon.com/images/M/MV5BNzMyNWZlYmYtZDgxMC00ZTU3LWFiYzctNGE0ZDc0OTlhZTRlXkEyXkFqcGc@._V1_SX300.jpg,65,6.6,"29,386",tt5822536,movie,N/A,"$45,770,312",N/A,N/A,True,6.6/10,65/100,,93%,,,,
Bring Them Down,2024,R,28 Mar 2025,106 min,"Drama, Thriller",Chris Andrews,"Chris Andrews, Jonathan Hourigan","Christopher Abbott, Barry Keoghan, Colm Meaney","An Irish shepherding family thrust into battle on several fronts: internal strife, hostility within the family, rivalry with another farmer. Paternalism, heritage, and the generational trauma cycle through the cultural prism of Ir...","English, Irish Gaelic","Ireland, United Kingdom, Belgium",4 wins & 4 nominations total,https://m.media-amazon.com/images/M/MV5BNWVhMGNlODgtYzAyMS00OGJhLTkyOGItNDY3MjA4NjVjYzMzXkEyXkFqcGc@._V1_SX300.jpg,63,6.5,"2,608",tt14186876,movie,N/A,"$336,339",N/A,N/A,True,6.5/10,63/100,,89%,,,,
,,,,,,,,,,,,,,,,,,,,,,,False,,,Incorrect IMDb ID.,,,,,
Heart Eyes,2025,R,07 Feb 2025,97 min,"Comedy, Horror, Mystery",Josh Ruben,"Phillip Murphy, Christopher Landon, Michael Kennedy","Mason Gooding, Olivia Holt, Gigi Zumbado","When two coworkers have to survive the Heart Eyes Killer on Valentine's Day, the two have to find out who it is.",English,"United States, New Zealand",1 nomination total,https://m.media-amazon.com/images/M/MV5BZDA4ZjVmM2MtYWJlNC00OTE5LThlOWQtYjQ4Yjg1ODg5MTE4XkEyXkFqcGc@._V1_SX300.jpg,61,6.1,"26,622",tt32558992,movie,N/A,"$30,415,738",N/A,N/A,True,6.1/10,61/100,,77%,,,,
Love Hurts,2009,PG-13,09 Sep 2009,90 min,"Comedy, Romance",Barra Grant,Barra Grant,"Richard E. Grant, Carrie-Anne Moss, Johnny Pacar",A newly separated father has to learn how to date again with help from his teenage son who himself dreams of conquering one girl's heart.,English,United States,4 wins & 1 nomination,https://m.media-amazon.com/images/M/MV5BMTc5MDYyMjM3MF5BMl5BanBnXkFtZTcwMTE5OTI1NA@@._V1_SX300.jpg,46,5.5,"1,492",tt1213825,movie,N/A,N/A,N/A,N/A,True,5.5/10,46/100,,29%,,,,
Love Hurts,1990,R,09 Nov 1990,106 min,"Comedy, Drama",Bud Yorkin,Ron Nyswaner,"Jeff Daniels, Cynthia Sikes Yorkin, Judith Ivey",The story of Paul Weaver and his strained relationships with women and his family.,English,United States,N/A,https://m.media-amazon.com/images/M/MV5BNWM1MmJiMzgtZjZhOC00ZTUzLTg0ZjItYWMzNzkzZDA1ZDcyXkEyXkFqcGc@._V1_SX300.jpg,N/A,5.4,429,tt0102341,movie,N/A,N/A,N/A,N/A,True,5.4/10,,,,,,,
Love Hurts,2009,N/A,N/A,6 min,"Short, Horror",Shariff Nasr,Terence,"Medi Broekman, Nasrdin Dchar, Déna Massque","When Wendy enters a public toilet heartbroken, unconsciously her tears awaken a darker force and it appears that she is not alone anymore.",English,Netherlands,N/A,https://m.media-amazon.com/images/M/MV5BY2FmZWZlZjEtN2FhYS00ZmM2LTk4NTktMzI3ZTBmNDExM2ZkXkEyXkFqcGdeQXVyODYzNzk5MQ@@._V1_SX300.jpg,N/A,6.0,55,tt1736617,movie,N/A,N/A,N/A,N/A,True,6.0/10,,,29%,,,,
Love Hurts,2025,R,07 Feb 2025,83 min,"Action, Comedy, Romance",Jonathan Eusebio,"Matthew Murray, Josh Stoddard, Luke Passmore","Ke Huy Quan, Ariana DeBose, Mustafa Shakir","A realtor is pulled back into the life he left behind after his former partner-in-crime resurfaces with an ominous message. With his crime-lord brother also on his trail, he must confront his past and the history he never fully bu...","English, Russian","United States, Japan",N/A,https://m.media-amazon.com/images/M/MV5BZDBmMTVkNWItZWY4Yy00MjI0LWFiMmMtMWM4ZGQ3NTg0MDE1XkEyXkFqcGc@._V1_SX300.jpg,34,5.3,"16,398",tt30788842,movie,N/A,"$15,683,090",N/A,N/A,True,5.3/10,34/100,,18%,,,,
Love Hurts,2022,N/A,14 Feb 2022,93 min,Thriller,Hiroshi Katagiri,"Aviva Dove-Viebahn, Brittany Fonte","Sean Sprawling, Simon Phillips, Sarah J. Butler","Six strangers are invited to a dinner party by a charming and enigmatic host, lured by the promise of substantial financial reward if they last the whole evening. However, all is not what it seems.",English,United States,N/A,https://m.media-amazon.com/images/M/MV5BNWEwOTViYjUtNzU1Ny00YTFhLThiNDEtMmYyYmNkM2I4YmYyXkEyXkFqcGc@._V1_SX300.jpg,N/A,3.5,343,tt14112680,movie,N/A,N/A,N/A,N/A,True,3.5/10,,,,,,,
,,,,,,,,,,,,,,,,,,,,,,,False,,,Incorrect IMDb ID.,,,,,
Love Hurts,2025,N/A,30 Mar 2025,N/A,Horror,Jamie Grefe,Jamie Grefe,"Mariana Carvajal, Jamie Grefe","When Mary arrives at the new sorority house, she thinks it's a dream come true. However, upon finding a strange crystal, she doesn't realize that she's awoken a masked killer. Trapped and afraid, Mary must fight back against this ...",N/A,United States,N/A,https://m.media-amazon.com/images/M/MV5BMzJkMzdhMmItMTE0NC00ZGNhLTkwZjYtN2VhNzc3MDFiMzAyXkEyXkFqcGc@._V1_SX300.jpg,N/A,N/A,N/A,tt34717918,movie,N/A,N/A,N/A,N/A,True,,,,18%,,,,
Becoming Led Zeppelin,2025,PG-13,14 Feb 2025,122 min,"Documentary, Music",Bernard MacMahon,"Bernard MacMahon, Allison McGourty","Led Zeppelin, Jimmy Page, John Paul Jones","The film traces the journeys of the four members of the Stairway To Heaven rockers through the music scene of the 1960s and their meeting in the summer of 1968, culminating in 1970.",English,"United Kingdom, United States",N/A,https://m.media-amazon.com/images/M/MV5BNTBhMzliNzYtMjQwMy00MjdhLWIyOGYtYzdiY2FlNjk3YTkzXkEyXkFqcGc@._V1_SX300.jpg,64,7.5,"5,786",tt10365912,movie,N/A,"$10,403,353",N/A,N/A,True,7.5/10,64/100,,85%,,,,
Valiant One,2025,R,31 Jan 2025,86 min,Thriller,Steve Barnett,"Eric Tipton, Steve Barnett, Daniel Myrick","Chase Stokes, Lana Condor, Desmin Borges","With tensions between North and South Korea, a US helicopter crashes on the North Korean side. Now the survivors must work together to protect a civilian tech specialist and find their way out without the help of US military support.","English, Korean",United States,N/A,https://m.media-amazon.com/images/M/MV5BZTQzMGU4NjAtNjVmMy00MDIwLWI2YTYtYjY3MTM2YzExMzJkXkEyXkFqcGc@._V1_SX300.jpg,N/A,5.0,"1,143",tt21442114,movie,N/A,"$1,236,630",N/A,N/A,True,5.0/10,,,29%,,,,
Companion,2021,N/A,11 Apr 2021,100 min,Horror,John Darbonne,John Darbonne,"Anna Flynn, Marcus Anthony, Russell Shealy","Across a post-apocalyptic landscape haunted by spirits, a guilt-stricken woman must choose to abandon her husband or die with him.",English,United States,25 wins & 18 nominations,https://m.media-amazon.com/images/M/MV5BYmEzNzllMTktOWRiMy00MDViLWFjODEtMWYwYjdmNzNlNjZjXkEyXkFqcGc@._V1_SX300.jpg,N/A,3.5,869,tt12093604,movie,N/A,N/A,N/A,N/A,True,3.5/10,,,,,,,
Companion,2025,R,31 Jan 2025,97 min,"Sci-Fi, Thriller",Drew Hancock,Drew Hancock,"Sophie Thatcher, Jack Quaid, Lukas Gage",A weekend getaway with friends at a remote cabin turns into chaos after it's revealed that one of the guests is not what they seem.,English,United States,2 wins & 8 nominations total,https://m.media-amazon.com/images/M/MV5BYjkyZTA5NzAtYWU3Zi00MWM4LTgxNzAtNDQxY2JmNjMwYjk4XkEyXkFqcGc@._V1_SX300.jpg,70,6.9,"146,359",tt26584495,movie,N/A,"$20,809,101",N/A,N/A,True,6.9/10,70/100,,93%,,,,
Companion,2020,N/A,30 May 2020,4 min,"Animation, Short","Joe Helliwell, Jack Walton",N/A,N/A,Short stop-motion film that expresses the friendship between a dog and a human. The story follows a dogs life and the interactions he has with his owner and other animals along the way.,N/A,United Kingdom,1 nomination,https://m.media-amazon.com/images/M/MV5BOWFjYWYxNTktYzdhMi00MWUxLWJmMjAtOTYzNGVjYmRmYmQ3XkEyXkFqcGdeQXVyMjk1NzAxNg@@._V1_SX300.jpg,N/A,N/A,N/A,tt15494824,movie,N/A,N/A,N/A,N/A,True,,,,,,,,
,,,,,,,,,,,,,,,,,,,,,,,False,,,Incorrect IMDb ID.,,,,,
Dog Man,2023,N/A,20 May 2023,6 min,"Short, Drama",Ryan McGibbon,"Ryan McGibbon, Toby Kearton","Mark Jarvis, Annabel Korolev","A man is forced to reconcile with his future, through his interaction with the household dog.",English,United Kingdom,N/A,https://m.media-amazon.com/images/M/MV5BMTRjNzIwYTctMTdmNC00Y2Q2LTliMzUtZWFmOTVhNzEzMTk4XkEyXkFqcGdeQXVyNDU0ODI1NjQ@._V1_SX300.jpg,N/A,N/A,13,tt27729769,movie,N/A,N/A,N/A,N/A,True,,,,,,,,
Companion,2015,N/A,N/A,17 min,"Short, Adventure, Romance",Andrew Crabtree,Andrew Crabtree,"Katherine Skelton, Denver Milord, Emma Fassler",Jody sets out on a dangerous wilderness adventure in order to connect with her fiancée who died hiking the very same trail.,English,USA,N/A,N/A,N/A,N/A,N/A,tt5142296,movie,N/A,N/A,N/A,N/A,True,,,,,,,,
Dog Man,2015,N/A,17 Oct 2015,57 min,Documentary,Richie Adams,N/A,Dick Russell,"A story about the life and legacy of a Louisiana dog trainer, and the global footprint he left after training an estimated 30,000 dogs.",English,United States,N/A,https://m.media-amazon.com/images/M/MV5BZWI1Y2JmMWUtZjc5My00ZWU0LWJiNzQtODA4YTQ4MDUwZjk1XkEyXkFqcGdeQXVyNDU0NjE0Mg@@._V1_SX300.jpg,N/A,N/A,27,tt5122290,movie,N/A,N/A,N/A,N/A,True,,,,,,,,
Green and Gold,2025,N/A,03 Jan 2025,105 min,Drama,Anders Lindwall,"Missy Mareau Garcia, Michael Graf, Anders Lindwall","Brandon Sklenar, Craig T. Nelson, M. Emmet Walsh","A struggling family farmer wagers everything on a high-stakes Championship bet, while his granddaughter's musical ambitions could be their ticket to a new beginning.",English,United States,2 wins total,https://m.media-amazon.com/images/M/MV5BNjFiYjI0YzItYjNkNC00OWRhLWE0ZjAtMzAyYmM3NTgxZTQ0XkEyXkFqcGc@._V1_SX300.jpg,59,6.8,428,tt15143042,movie,N/A,"$1,719,105",N/A,N/A,True,6.8/10,59/100,,67%,,,,
,,,,,,,,,,,,,,,,,,,,,,,False,,,Incorrect IMDb ID.,,,,,
Dog Man,2025,PG,31 Jan 2025,89 min,"Animation, Action, Adventure",Peter Hastings,"Peter Hastings, Dav Pilkey","Pete Davidson, Poppy Liu, Lil Rel Howery","After a policeman and his police dog are fused together to turn into Dog Man, he must stop the villainous Petey the Cat from cloning himself and creating an evil kitten, doubling his evil abilities.",English,United States,1 nomination total,https://m.media-amazon.com/images/M/MV5BNDVlZGQyM2MtNjA2OS00MjdkLThiNDQtZTYzMTA1MGU3M2M0XkEyXkFqcGc@._V1_SX300.jpg,66,6.3,"12,006",tt10954718,movie,N/A,"$97,970,355",N/A,N/A,True,6.3/10,66/100,,81%,,,,
Inheritance,2005,N/A,08 Apr 2005,9 min,"Drama, Short",Paul Cuoco,Paul Cuoco,"Richard Meese, Robert Olufs, Harrison Young","In an impassioned message from the grave, one concentration camp Liberator forces us to remember the horror humanity is capable of. Utilizing actual photos from the Buchenwald concentration camp, and a soulful performance by Harri...",English,United States,N/A,https://m.media-amazon.com/images/M/MV5BNTRmZGQ4Y2EtYTg4OC00N2JmLWJmZWMtZmE3OTRmMmM0ZWNlXkEyXkFqcGdeQXVyMzI2MjIxOA@@._V1_SX300.jpg,N/A,8.6,7,tt0455555,movie,N/A,N/A,N/A,N/A,True,8.6/10,,,,,,,
Presence,2024,R,24 Jan 2025,84 min,"Drama, Horror, Thriller",Steven Soderbergh,David Koepp,"Lucy Liu, Chris Sullivan, Callina Liang",A family becomes convinced they are not alone after moving into their new home in the suburbs.,English,United States,N/A,https://m.media-amazon.com/images/M/MV5BZWRmNzM1YjktM2YyMi00M2YwLWE2YjMtNjgwNTQ3MGU3MzczXkEyXkFqcGc@._V1_SX300.jpg,77,6.1,"36,695",tt28249919,movie,N/A,"$6,900,044",N/A,N/A,True,6.1/10,77/100,,88%,,,,
Flight Risk,2025,R,24 Jan 2025,91 min,"Action, Crime, Drama",Mel Gibson,Jared Rosenberg,"Michelle Dockery, Mark Wahlberg, Topher Grace","A pilot transports an Air Marshal accompanying a fugitive to trial. As they cross the Alaskan wilderness, tensions soar and trust is tested, as not everyone on board is who they seem.",English,United States,N/A,https://m.media-amazon.com/images/M/MV5BOGZlZjAyYTItMDdjYy00OGZlLWI3NDAtYzM5ZjAwNjg0NWUxXkEyXkFqcGc@._V1_SX300.jpg,38,5.3,"36,816",tt10078772,movie,N/A,"$29,783,527",N/A,N/A,True,5.3/10,38/100,,29%,,,,
,,,,,,,,,,,,,,,,,,,,,,,False,,,Incorrect IMDb ID.,,,,,
Inheritance,2023,N/A,17 Aug 2023,19 min,"Short, Drama",Erin Lau,Justin Omori,"Brandon Finn, James Koons, Jaden Murakami",A struggling nature photographer is forced to confront the pain his family has carried for generations.,English,United States,N/A,https://m.media-amazon.com/images/M/MV5BZTI0ZjFhZjMtZmM1YS00MzU0LTgzMzUtZjI4MjUyOGZhYjkwXkEyXkFqcGc@._V1_SX300.jpg,N/A,N/A,N/A,tt20869634,movie,N/A,N/A,N/A,N/A,True,,,,,,,,
Inheritance,2005,N/A,01 Sep 2005,86 min,Drama,Edward Porembny,"Delphine Dewulf, Andrew Hislop","Pawel Burczyk, Krzysztof Kolberger, Maciej Kowalewski",Inheritance sees a middle-aged loner reuniting with a friend from his teenage years only to be shocked by modern day reality and horrified by the revelation that the porn star he becomes entangled with is his daughter.,"English, Polish","Poland, United Kingdom",N/A,https://m.media-amazon.com/images/M/MV5BYTI0ODc2MGMtOThkMi00ODJhLWIzNzYtMzdlMjkxZDY4NWU2XkEyXkFqcGdeQXVyODMyNzk0Ng@@._V1_SX300.jpg,N/A,5.2,24,tt0757993,movie,N/A,N/A,N/A,N/A,True,5.2/10,,,,,,,
Inheritance,2021,N/A,N/A,86 min,"Horror, Mystery, Thriller",Michael Kenneth Fahr,Michael Kenneth Fahr,"Michael Kenneth Fahr, Christopher Sarlls, Christopher Patrino","After the murder of their parents,Nick and Steve Wellington are left to share their Inheritance. However, when the masked Figure shows back up to finish what was started, everyone will learn the hard way that blood runs thicker th...",English,United States,10 wins & 6 nominations,https://m.media-amazon.com/images/M/MV5BY2FhM2ViNTMtYWJiOS00ZDRiLWE4ZDktNWNhZTVhNmFjNmQwXkEyXkFqcGc@._V1_SX300.jpg,N/A,N/A,31,tt10472094,movie,N/A,N/A,N/A,N/A,True,,,,,,,,
Presence,2022,Unrated,17 Nov 2022,82 min,Horror,Christian Schultz,"Peter Ambrosio, Christian Schultz","Jenna Lyng Adams, Donny Broussard, Dave Davis","Two young business partners are invited to a week-long yachting voyage with a potential investor. At night, Jennifer's dreams begin to bleed into reality as the others realize that Jennifer may have unknowingly brought something o...",English,United States,N/A,https://m.media-amazon.com/images/M/MV5BZmZmOGQyNDctY2MxMy00NzQxLWFhMzUtMTlhMzgxMjhlMzFkXkEyXkFqcGc@._V1_SX300.jpg,N/A,3.5,268,tt12993004,movie,N/A,N/A,N/A,N/A,True,3.5/10,,,,,,,
,,,,,,,,,,,,,,,,,,,,,,,False,,,Incorrect IMDb ID.,,,,,
Inheritance,2020,TV-MA,22 May 2020,111 min,"Drama, Mystery, Thriller",Vaughn Stein,Matthew Kennedy,"Lily Collins, Simon Pegg, Connie Nielsen","The patriarch of a wealthy and powerful family suddenly passes away, leaving his daughter with a shocking secret inheritance that threatens to unravel and destroy the family.",English,"United States, United Kingdom",N/A,https://m.media-amazon.com/images/M/MV5BYTBkOTgwMjktOTI4Ny00YmY1LTlkYjQtZjkwOTcwYzkwMTM0XkEyXkFqcGc@._V1_SX300.jpg,31,5.6,"22,480",tt7923220,movie,N/A,N/A,N/A,N/A,True,5.6/10,31/100,,24%,,,,
,,,,,,,,,,,,,,,,,,,,,,,False,,,Incorrect IMDb ID.,,,,,
Inheritance,2017,N/A,02 Jun 2017,90 min,"Drama, Horror, Mystery",Tyler Savage,Tyler Savage,"Chase Joliet, Sara Montez, Dale Dickey","A man inherits a beach house from his biological father, a man he never knew and thought long dead. But the dream property holds more than a few family secrets.",English,United States,1 win & 1 nomination,https://m.media-amazon.com/images/M/MV5BMjFjMTBjMDItOTQ5Ni00MDdiLThhNGItMDQzZmFkNmM1MjIzXkEyXkFqcGdeQXVyODA2OTczNQ@@._V1_SX300.jpg,N/A,3.5,494,tt5580602,movie,N/A,N/A,N/A,N/A,True,3.5/10,,,,,,,
