Title,Year,Rated,Released,Runtime,Genre,Director,Writer,Actors,Plot,Language,Country,Awards,Poster,Metascore,imdbRating,imdbVotes,imdbID,Type,DVD,BoxOffice,Production,Website,Response,Rating_InternetMovieDatabase,Error,Rating_RottenTomatoes,Rating_Metacritic,Season,Episode,seriesID,totalSeasons
Long Shot,2019,R,03 May 2019,125 min,"Comedy, Romance",Jonathan Levine,"Dan Sterling, Liz Hannah","Charlize Theron, Seth Rogen, June Diane Raphael","Journalist, Fred Flarsky, reunites with his childhood crush, Charlotte Field; now one of the most influential women in the world. As she prepares to run for president, Charlotte hires Fred as her speechwriter, and sparks fly.","English, Swedish, French, Vietnamese, Russian, Hebrew","United States, Canada, Colombia",5 wins & 13 nominations total,https://m.media-amazon.com/images/M/MV5BY2E2NDIwMGUtNmFkZC00NDFjLWI5ZWMtMTE1M2E2YTM1OWVlXkEyXkFqcGc@._V1_SX300.jpg,67,6.8,"127,303",tt2139881,movie,N/A,"$30,316,271",N/A,N/A,True,6.8/10,,82%,67/100,,,,
,,,,,,,,,,,,,,,,,,,,,,,False,,Incorrect IMDb ID.,,,,,,
The Intruder,2024,N/A,30 Jan 2025,101 min,Thriller,Jack Brame,Jack Brame,"David Gow, Steve McNair, Monica Bell","A young, paranoid man begins to believe someone is breaking into his house every night.",English,United States,5 wins & 5 nominations total,https://m.media-amazon.com/images/M/MV5BZjViMWRkNDYtZTllMi00ZTNhLTliOTYtMzFjYzlhODUyMGYxXkEyXkFqcGc@._V1_SX300.jpg,N/A,5.0,300,tt32117345,movie,N/A,N/A,N/A,N/A,True,5.0/10,,,,,,,
,,,,,,,,,,,,,,,,,,,,,,,False,,Incorrect IMDb ID.,,,,,,
,,,,,,,,,,,,,,,,,,,,,,,False,,Incorrect IMDb ID.,,,,,,
Long Shot,2017,TV-14,29 Sep 2017,40 min,"Documentary, Crime, Sport",Jacob LaMendola,N/A,"Juan Catalan, Alma Oseguera, Todd Melnik","When Juan Catalan is arrested for a murder he didn't commit, he builds his case around raw footage from the popular TV show, Curb Your Enthusiasm (2000).",English,United States,1 win & 3 nominations total,https://m.media-amazon.com/images/M/MV5BYTMyNWMwOWMtYWIzNC00Y2FkLTg1YjUtZDg0NmU0MTYxMTBlXkEyXkFqcGc@._V1_SX300.jpg,N/A,7.4,"9,064",tt7344360,movie,N/A,N/A,N/A,N/A,True,7.4/10,,88%,,,,,
The Intruder,1994,N/A,09 Mar 1994,90 min,"Horror, Thriller",Richard Wolstencroft,Frank Howson,"Tottie Goldsmith, Lachy Hulme, Paul Moder",A couple are terrorised in their own home by a mysterious intruder.,English,Australia,N/A,N/A,N/A,2.5,39,tt0402129,movie,N/A,N/A,N/A,N/A,True,2.5/10,,,,,,,
The Intruder,2019,PG-13,03 May 2019,102 min,"Horror, Thriller",Deon Taylor,David Loughery,"Michael Ealy, Meagan Good, Dennis Quaid","A young married couple buy a beautiful house on several acres of land, only to find out that the man they bought it from refuses to let go of the property.",English,"United States, Canada",N/A,https://m.media-amazon.com/images/M/MV5BNTczMzc4NDY0MF5BMl5BanBnXkFtZTgwMjI3Njg3NjM@._V1_SX300.jpg,39,5.6,"20,016",tt6722030,movie,N/A,"$35,419,122",N/A,N/A,True,5.6/10,,35%,39/100,,,,
Long Shot,1978,N/A,01 Jun 1980,85 min,Drama,Maurice Hatton,"Maurice Hatton, Eoin McCann","Charles Gormley, Neville Smith, Ann Zelda","Filmed around the 1977 Edinburgh Film Festival, Long Shot is a deadpan satire about the trials and tribulations of British independent filmmaking.","English, German",United Kingdom,N/A,https://m.media-amazon.com/images/M/MV5BMjYwZWVmYzctZjk4NS00ZGYzLTg5Y2EtMDZjYjE4Y2VkMjE5XkEyXkFqcGdeQXVyMTk0MjQ3Nzk@._V1_SX300.jpg,N/A,5.8,99,tt0077867,movie,N/A,N/A,N/A,N/A,True,5.8/10,,,,,,,
The Curse of La Llorona,2019,R,19 Apr 2019,93 min,"Horror, Mystery, Thriller",Michael Chaves,"Mikki Daughtry, Tobias Iaconis","Linda Cardellini, Raymond Cruz, Patricia Velasquez","Ignoring the eerie warning of a troubled mother suspected of child endangerment, a social worker and her own small kids are soon drawn into a frightening supernatural realm.","English, Spanish",United States,1 win & 7 nominations total,https://m.media-amazon.com/images/M/MV5BMWFkNjBkYjQtYjQyNC00NDIxLTg3ZDQtNDU3YzRiYWI5NjQyXkEyXkFqcGc@._V1_SX300.jpg,41,5.3,"63,754",tt4913966,movie,N/A,"$54,733,739",N/A,N/A,True,5.3/10,,26%,41/100,,,,
Fast Color,2018,PG-13,19 Apr 2019,100 min,"Drama, Sci-Fi, Thriller",Julia Hart,"Julia Hart, Jordan Horowitz","Gugu Mbatha-Raw, Lorraine Toussaint, Saniyya Sidney","After years in hiding, a woman is forced to go on the run when her superhuman abilities are discovered. Years after having abandoned her family, the only place she has left to hide is home.",English,United States,1 win & 7 nominations total,https://m.media-amazon.com/images/M/MV5BNTRiZGU4YTUtMWM2MS00OTRkLWI5N2ItYTdlZGU4NTFkMjhjXkEyXkFqcGc@._V1_SX300.jpg,64,6.1,"7,280",tt6418778,movie,N/A,"$76,916",N/A,N/A,True,6.1/10,,83%,64/100,,,,
Little Woods,2018,R,19 Apr 2019,105 min,"Crime, Drama, Western",Nia DaCosta,Nia DaCosta,"Tessa Thompson, Lily James, Luke Kirby","In Little Woods North Dakota, two estranged sisters are driven to extremes when their mother dies, leaving them with one week to pay back her mortgage.",English,United States,6 wins & 6 nominations,https://m.media-amazon.com/images/M/MV5BYWEyM2JmNjktYmZmZi00NDRkLWFhOTUtZjI0NzI0NjM4N2RmXkEyXkFqcGc@._V1_SX300.jpg,74,6.2,"4,167",tt6418918,movie,N/A,"$150,010",N/A,N/A,True,6.2/10,,95%,74/100,,,,
Under the Silver Lake,2018,R,19 Apr 2019,139 min,"Crime, Horror, Mystery",David Robert Mitchell,David Robert Mitchell,"Andrew Garfield, Riley Keough, Topher Grace","Sam, a disenchanted young man, finds a mysterious woman swimming in his apartment's pool one night. The next morning, she disappears. Sam sets off across LA to find her, and along the way he uncovers a conspiracy far more bizarre.",English,United States,3 wins & 9 nominations total,https://m.media-amazon.com/images/M/MV5BMTMzN2JkZDAtYjgyMy00M2QxLWE2NWItNTEyZGVlNTgyYTViXkEyXkFqcGc@._V1_SX300.jpg,60,6.5,"57,801",tt5691670,movie,N/A,"$46,083",N/A,N/A,True,6.5/10,,58%,60/100,,,,
Breakthrough,1950,Approved,27 Jul 1951,91 min,"Drama, War",Lewis Seiler,"Joseph Breen, Bernard Girard, Ted Sherdeman","David Brian, John Agar, Frank Lovejoy","An American infantry unit, from its pre-invasion training to combat in Europe.",English,United States,N/A,https://m.media-amazon.com/images/M/MV5BYjliZTQ5NDctODE2Ni00ZTIyLWJjODQtNzNjNzg5YmYzZWIwXkEyXkFqcGc@._V1_SX300.jpg,N/A,6.7,462,tt0042282,movie,N/A,N/A,N/A,N/A,True,6.7/10,,,,,,,
Breakthrough,2019,PG,17 Apr 2019,116 min,"Biography, Drama",Roxann Dawson,"Joyce Smith, Grant Nieporte","Marcel Ruiz, Topher Grace, Sarah Constible","When her 14-year-old son drowns in a lake, a faithful mother prays for him to come back from the brink of death and be healed.",English,"United States, Canada",Nominated for 1 Oscar. 2 wins & 11 nominations total,https://m.media-amazon.com/images/M/MV5BNmU1NWU3MWYtMWIzZC00YzgwLWI3ODktZGYyNzJmNTIwZDgxXkEyXkFqcGc@._V1_SX300.jpg,46,6.3,"11,613",tt7083526,movie,N/A,"$40,713,082",N/A,N/A,True,6.3/10,,60%,46/100,,,,
,,,,,,,,,,,,,,,,,,,,,,,False,,Incorrect IMDb ID.,,,,,,
Little,2019,PG-13,12 Apr 2019,109 min,"Comedy, Fantasy, Romance",Tina Gordon,"Tracy Oliver, Tina Gordon","Regina Hall, Issa Rae, Marsai Martin",A woman is transformed into her younger self at a point in her life when the pressures of adulthood become too much to bear.,English,"China, United States",3 wins & 6 nominations total,https://m.media-amazon.com/images/M/MV5BMTU2NDYwNzkzMV5BMl5BanBnXkFtZTgwNjAyMjMxNzM@._V1_SX300.jpg,49,5.6,"15,655",tt8085790,movie,N/A,"$40,860,481",N/A,N/A,True,5.6/10,,46%,49/100,,,,
Red Joan,2018,R,19 Apr 2019,101 min,"Biography, Drama, History",Trevor Nunn,"Lindsay Shapero, Jennie Rooney","Judi Dench, Sophie Cookson, Stephen Campbell Moore","The story of Joan Stanley, who was exposed as the K.G.B.'s longest-serving British spy.",English,United Kingdom,N/A,https://m.media-amazon.com/images/M/MV5BZGE0NWM0ZjQtNDRhYi00M2E0LWE2ZGYtN2ZjY2UyMWUzMDM5XkEyXkFqcGc@._V1_SX300.jpg,45,6.4,"14,828",tt7615302,movie,N/A,"$1,579,730",N/A,N/A,True,6.4/10,,30%,45/100,,,,
Little,2018,N/A,04 Sep 2018,12 min,"Short, Horror",Brittany Brock,Brittany Brock,"Mary Grace Copeland, Nico Ford","An unexpected meeting turns dangerous as two children navigate the desolate, wooded terrain of their developing town.",English,United States,N/A,N/A,N/A,N/A,N/A,tt9866252,movie,N/A,N/A,N/A,N/A,True,,,,,,,,
Jim Allison: Breakthrough,2019,PG-13,27 Sep 2019,90 min,Documentary,Bill Haney,Bill Haney,"Jim Allison, Sharon Belvin, Eric Benson",Renegade Texan scientist Jim Allison devotes his life work to find a cure for cancer after the disease takes the life of his mother.,English,United States,8 wins & 7 nominations,https://m.media-amazon.com/images/M/MV5BZjhhZGI5NzQtNGJiNy00ZmUwLWE1NGItOWQ0YzRlODc0YjYzXkEyXkFqcGc@._V1_SX300.jpg,71,7.6,236,tt9617570,movie,N/A,"$87,984",N/A,N/A,True,7.6/10,,60%,71/100,,,,
Hellboy,2019,R,12 Apr 2019,120 min,"Action, Adventure, Fantasy",Neil Marshall,"Andrew Cosby, Mike Mignola","David Harbour, Milla Jovovich, Ian McShane","Caught between the worlds of the supernatural and human, Hellboy battles an ancient sorceress bent on revenge.","English, Spanish, Russian, German","United States, United Kingdom, Bulgaria, Canada, Portugal, France",1 win & 8 nominations total,https://m.media-amazon.com/images/M/MV5BZjI1Yzc0M2MtZjc5Ny00ZDU0LWE3NzEtOWY5ODk2MzdhZThjXkEyXkFqcGc@._V1_SX300.jpg,31,5.3,"105,623",tt2274648,movie,N/A,"$21,903,748",N/A,N/A,True,5.3/10,,17%,31/100,,,,
Mary Magdalene,2017,N/A,01 Jul 2017,5 min,N/A,M.M. Serra,N/A,N/A,"'Mary Magdalene' is separate from you, but comes from you. It is a brilliant, explosive, fierce and passionate gem, the kind that catches light but can also cut. As I said last night, the ...",English,USA,N/A,N/A,N/A,N/A,N/A,tt8347508,movie,N/A,N/A,N/A,N/A,True,,,,,,,,
Wild Nights with Emily,2018,PG-13,01 Jun 2022,84 min,"Comedy, History",Madeleine Olnek,Madeleine Olnek,"Molly Shannon, Susan Ziegler, Amy Seimetz","Dramatization of the little known side of the writer Emily Dickinson's life, in particular, her relationship with another woman.",English,United States,3 wins & 7 nominations,https://m.media-amazon.com/images/M/MV5BMTA5MjQ0Mjg1NzReQTJeQWpwZ15BbWU4MDkyODQ5NTcz._V1_SX300.jpg,74,6.2,"1,467",tt5176580,movie,N/A,"$519,487",N/A,N/A,True,6.2/10,,89%,74/100,,,,
Breakthrough,2024,N/A,15 Feb 2024,12 min,"Documentary, Short",Ja-Mar Jones,Jared A. Johnston,D'joun Smith,Breakthrough is a documentary that explores how athletes face identity crisis and depression after a life-altering event that results in their removal from the sport on a professional level.,N/A,United States,N/A,https://m.media-amazon.com/images/M/MV5BNWU4NzMzMzQtOGYzZi00NWRmLTk3M2UtNzc2ZGMyZGExOTkxXkEyXkFqcGc@._V1_SX300.jpg,N/A,N/A,N/A,tt32267663,movie,N/A,N/A,N/A,N/A,True,,,,,,,,
,,,,,,,,,,,,,,,,,,,,,,,False,,Incorrect IMDb ID.,,,,,,
,,,,,,,,,,,,,,,,,,,,,,,False,,Error getting data.,,,,,,
Mary Magdalene,2018,R,15 Mar 2018,120 min,"Biography, Drama, History",Garth Davis,"Helen Edmundson, Philippa Goslett","Rooney Mara, Joaquin Phoenix, Chiwetel Ejiofor",Twelve men heard and spread the message of Jesus. Only one woman understood it.,"English, Hebrew","United Kingdom, Australia, United States, Italy",2 wins & 5 nominations,https://m.media-amazon.com/images/M/MV5BZjBkOGFlMTItNWEzMC00ZTk5LTg3YzAtYTI2MDdiN2ViZjBkXkEyXkFqcGc@._V1_SX300.jpg,48,5.9,"11,760",tt5360996,movie,N/A,"$124,741",N/A,N/A,True,5.9/10,,44%,48/100,,,,
Breakthrough,2013,N/A,N/A,15 min,"Short, Drama, Mystery",Damien Goodwin,Davey Jones,"David Ajala, Gillian Kearney, Patrick O'Kane",A doctor indulges the delusions of a patient to overcome a past tragedy and bring them back to reality.,English,United Kingdom,N/A,N/A,N/A,7.9,10,tt2778484,movie,N/A,N/A,N/A,N/A,True,7.9/10,,,,,,,
Hellboy,2004,PG-13,02 Apr 2004,122 min,"Action, Adventure, Fantasy",Guillermo del Toro,"Guillermo del Toro, Peter Briggs, Mike Mignola","Ron Perlman, Doug Jones, Selma Blair","A demon raised from infancy after being conjured by and rescued from the Nazis, grows up to become a defender against the forces of darkness.","English, Russian, German, Latin",United States,3 wins & 23 nominations total,https://m.media-amazon.com/images/M/MV5BMWZhODhmZjktNmIzNC00NGRmLTkyMDEtODVmMzVmNGQwYWU0XkEyXkFqcGc@._V1_SX300.jpg,72,6.9,"365,031",tt0167190,movie,N/A,"$59,623,958",N/A,N/A,True,6.9/10,,81%,72/100,,,,
,,,,,,,,,,,,,,,,,,,,,,,False,,Incorrect IMDb ID.,,,,,,
The Wind,2016,N/A,01 Oct 2016,10 min,"Short, Drama, Horror, Thriller",Jim Henry,Jim Henry,"William David Amendola, Ruby Bullock-Spitz, Elinor Day, Nala","A great wind blows around the world and seven years after the beginning of the end of civilization, people, water and food are scarce until a stranger appears one day.",English,Canada,N/A,https://m.media-amazon.com/images/M/MV5BMDUzYmJkOWItNjdiYi00ZmFlLWE1OTgtZDlkOTViZTU4ZDE4XkEyXkFqcGdeQXVyNjYxNzYxNjI@._V1_SX300.jpg,N/A,N/A,N/A,tt6094886,movie,N/A,N/A,N/A,N/A,True,,,,,,,,
Pet Sematary,2019,R,05 Apr 2019,100 min,"Horror, Mystery, Thriller","Kevin Kölsch, Dennis Widmyer","Stephen King, Matt Greenberg, Jeff Buhler","Jason Clarke, Amy Seimetz, John Lithgow","Dr. Louis Creed and his wife, Rachel, relocate from Boston to rural Maine with their two young children. The couple soon discover a mysterious burial ground hidden deep in the woods near their new home.",English,"United States, Canada",1 win & 9 nominations total,https://m.media-amazon.com/images/M/MV5BNWQ0ZTQ2NTQtNGQ3MS00YTdlLThlOTAtZDBiZDkzNDk1MDk2XkEyXkFqcGc@._V1_SX300.jpg,57,5.7,"102,427",tt0837563,movie,N/A,"$54,724,696",N/A,N/A,True,5.7/10,,57%,57/100,,,,
Shazam!,2019,PG-13,05 Apr 2019,132 min,"Action, Adventure, Comedy",David F. Sandberg,"Henry Gayden, Darren Lemke, Bill Parker","Zachary Levi, Mark Strong, Asher Angel",A newly fostered young boy in search of his mother instead finds unexpected super powers and soon gains a powerful enemy.,"English, Spanish","United States, Canada",27 nominations total,https://m.media-amazon.com/images/M/MV5BZWM1YjdmOGQtNGYyMC00NjMwLTk1OWUtMGYzM2NjYjliYzYyXkEyXkFqcGc@._V1_SX300.jpg,71,7.0,"406,262",tt0448115,movie,N/A,"$140,480,049",N/A,N/A,True,7.0/10,,90%,71/100,,,,
The Best of Enemies,1961,Approved,06 Aug 1962,104 min,"Adventure, Comedy, War",Guy Hamilton,"Suso Cecchi D'Amico, Agenore Incrocci, Jack Pulman","David Niven, Alberto Sordi, Amedeo Nazzari",In 1941 during the desert war in Abyssinia the Italian captain Blasi and the British major Richardson alternate between being bitter enemies or best friends depending on the circumstances.,"Italian, English","United Kingdom, Italy",Nominated for 2 BAFTA 1 win & 6 nominations total,https://m.media-amazon.com/images/M/MV5BNTJiODQ0OTgtYWZhMy00OTA4LWIwYTUtOTdiMThhYTM0Mjk4XkEyXkFqcGc@._V1_SX300.jpg,N/A,6.7,787,tt0054678,movie,N/A,N/A,N/A,N/A,True,6.7/10,,,,,,,
The Best of Enemies,2019,PG-13,05 Apr 2019,133 min,"Biography, Drama, History",Robin Bissell,"Robin Bissell, Osha Gray Davidson","Taraji P. Henson, Sam Rockwell, Babou Ceesay","Civil rights activist Ann Atwater faces off against C.P. Ellis, Exalted Cyclops of the Ku Klux Klan, in 1971 Durham, North Carolina over the issue of school integration.","English, Latin",United States,5 nominations total,https://m.media-amazon.com/images/M/MV5BMjQ5MjA2NDkyM15BMl5BanBnXkFtZTgwNTIwNjUzNzM@._V1_SX300.jpg,49,7.3,"20,870",tt4807408,movie,N/A,"$10,205,616",N/A,N/A,True,7.3/10,,51%,49/100,,,,
The Wind,2025,N/A,01 Jan 2025,11 min,"Short, Mystery",Adam Peditto,Adam Peditto,"Robin Guiver, Leonidas Ocampo, Michael Short","On the outskirts of a dying frontier town, a desperate miner seeks refuge in a church as a windstorm rages outside. Consumed by panic, the man recounts his troubles to a reluctant priest. What starts as a plea for protection soon ...",English,United Kingdom,N/A,https://m.media-amazon.com/images/M/MV5BN2MzN2QwN2MtZTYwZS00YTRiLWJiYWEtNmJjZTVjNDc0ZWQ2XkEyXkFqcGc@._V1_SX300.jpg,N/A,N/A,N/A,tt33050089,movie,N/A,N/A,N/A,N/A,True,,,,,,,,
The Wind,1986,Not Rated,25 Nov 1987,92 min,"Horror, Thriller",Nico Mastorakis,"Nico Mastorakis, Fred Perry","Meg Foster, Wings Hauser, David McCallum","A popular crime novelist moves to a historic Greek village during the off-season in order to write her next book, but gets more than she bargained for when she strongly suspects a man of committing murder.",English,"United States, Greece",N/A,https://m.media-amazon.com/images/M/MV5BOTJiZjc3ZjMtYjZiMi00NDllLWE3YWMtMmY1MDY3YzYxYThiXkEyXkFqcGc@._V1_SX300.jpg,N/A,5.1,"2,072",tt0094327,movie,N/A,N/A,N/A,N/A,True,5.1/10,,,,,,,
The Wind,1928,Not Rated,23 Nov 1928,95 min,"Drama, Romance, Thriller",Victor Sjöström,"Frances Marion, Dorothy Scarborough, John Colton","Lillian Gish, Lars Hanson, Montagu Love","A frail young woman from the East moves in with her cousin in the West, where she causes tension within the family and is slowly driven mad.","None, English",United States,3 wins,https://m.media-amazon.com/images/M/MV5BMzAwZWU4MWUtYzBkZS00YjFjLWE4MzMtZGM5MTAwY2ZjMmUyXkEyXkFqcGc@._V1_SX300.jpg,N/A,8.0,"7,309",tt0019585,movie,N/A,N/A,N/A,N/A,True,8.0/10,,100%,,,,,
,,,,,,,,,,,,,,,,,,,,,,,False,,Incorrect IMDb ID.,,,,,,
,,,,,,,,,,,,,,,,,,,,,,,False,,Incorrect IMDb ID.,,,,,,
The Public,2018,PG-13,25 Jul 2019,119 min,Drama,Emilio Estevez,Emilio Estevez,"Alec Baldwin, Taylor Schilling, Emilio Estevez",An act of civil disobedience turns into a standoff with police when homeless people in Cincinnati take over the public library to seek shelter from the bitter cold.,"English, Sign ",United States,5 wins & 1 nomination total,https://m.media-amazon.com/images/M/MV5BZjEyNjZmODYtNmMwZi00ODhjLTk3ODQtYTk2YzNiYjZlNzEyXkEyXkFqcGc@._V1_SX300.jpg,46,6.6,"4,662",tt3294746,movie,N/A,"$573,503",N/A,N/A,True,6.6/10,,65%,46/100,,,,
The Wind,2001,R,28 Jul 2001,90 min,"Drama, Horror, Mystery",Michael Mongillo,"James Charbonneau, Michael Mongillo","Carolyn Camburn, Philipp Karner, Zeke Rippy","An ancient wind carries with it omens of the apocalypse, stirring the pride, guilt and envy of a group of college kids to murderous rage.",English,United States,2 wins,https://m.media-amazon.com/images/M/MV5BYTlkMzllMzgtMjIxZS00ZTViLThhZDItOWEyMTY3MTM2ZWViXkEyXkFqcGc@._V1_SX300.jpg,N/A,2.9,255,tt0329768,movie,N/A,N/A,N/A,N/A,True,2.9/10,,,,,,,
The Wind,2018,R,05 Apr 2019,88 min,"Drama, Horror, Mystery",Emma Tammi,Teresa Sutherland,"Caitlin Gerard, Julia Goldani Telles, Ashley Zukerman",A plains-woman faces the harshness and isolation of the untamed land in the Western frontier of the late 1800s.,English,United States,1 win & 6 nominations total,https://m.media-amazon.com/images/M/MV5BOTJmNzFhNTUtNDZmZS00M2Y4LTkyNWMtNDhkNjg2NDg4OGJhXkEyXkFqcGc@._V1_SX300.jpg,66,5.6,"10,004",tt8426594,movie,N/A,"$28,252",N/A,N/A,True,5.6/10,,82%,66/100,,,,
High Life,2009,R,16 Mar 2010,80 min,"Comedy, Crime",Gary Yates,"Lee MacDougall, Brad Caslor, Daniel Nemiroff","Timothy Olyphant, Stephen Eric McIntyre, Joe Anderson","In 1983, four hapless junkies plan to rob an ATM.","English, French",Canada,2 wins & 6 nominations total,https://m.media-amazon.com/images/M/MV5BMTI5MDEyMjMyNF5BMl5BanBnXkFtZTcwNDYxMDExMw@@._V1_SX300.jpg,N/A,6.0,"3,492",tt1143110,movie,N/A,N/A,N/A,N/A,True,6.0/10,,83%,,,,,
High Life,2018,R,12 Apr 2019,113 min,"Drama, Sci-Fi, Thriller",Claire Denis,"Claire Denis, Jean-Pol Fargeau, Geoff Cox","Robert Pattinson, Juliette Binoche, André 3000",A father and his daughter struggle to survive in deep space where they live in isolation.,English,"France, United Kingdom, Germany, Poland, United States",5 wins & 22 nominations total,https://m.media-amazon.com/images/M/MV5BNDRhYjdiMDEtN2UzZC00ZGQyLTk3OTQtMTFkZGQ0YmM5NDk4XkEyXkFqcGc@._V1_SX300.jpg,78,5.7,"44,508",tt4827558,movie,N/A,"$1,225,852",N/A,N/A,True,5.7/10,,83%,78/100,,,,
Pet Sematary,1989,R,21 Apr 1989,103 min,"Fantasy, Horror, Thriller",Mary Lambert,Stephen King,"Dale Midkiff, Denise Crosby, Fred Gwynne","After tragedy strikes, a grieving father discovers an ancient burial ground behind his home with the power to raise the dead.",English,United States,1 win & 6 nominations total,https://m.media-amazon.com/images/M/MV5BZTEyYWIyZWYtMTM5OC00M2ZmLWI5NzMtZjA0ZTI4MTQ4ZDZkXkEyXkFqcGc@._V1_SX300.jpg,38,6.5,"121,808",tt0098084,movie,N/A,"$57,469,467",N/A,N/A,True,6.5/10,,58%,38/100,,,,
Diane,1956,Approved,12 Jan 1956,110 min,"Drama, History, Mystery",David Miller,"John Erskine, Christopher Isherwood","Lana Turner, Pedro Armendáriz, Roger Moore","In the sixteenth century, a noblewoman has a love affair with the French King.",English,United States,N/A,https://m.media-amazon.com/images/M/MV5BNTkxNGUyZTAtNjBhOS00MGNmLWExNTEtNTEzM2VmOGU0NDNmXkEyXkFqcGdeQXVyMTIzMzQ1ODg4._V1_SX300.jpg,N/A,6.1,519,tt0049140,movie,N/A,N/A,N/A,N/A,True,6.1/10,,,,,,,
The Beach Bum,2019,R,29 Mar 2019,95 min,"Comedy, Drama",Harmony Korine,Harmony Korine,"Matthew McConaughey, Snoop Dogg, Isla Fisher",A rebellious stoner named Moondog lives life by his own rules.,"English, Spanish","Switzerland, United Kingdom, France, United States",1 win & 7 nominations total,https://m.media-amazon.com/images/M/MV5BZGU5MzRkY2MtYWIyMS00NzU5LWE0NmQtMjMwYmE4NTkyMjA2XkEyXkFqcGc@._V1_SX300.jpg,55,5.5,"26,099",tt6511932,movie,N/A,"$3,502,600",N/A,N/A,True,5.5/10,,58%,55/100,,,,
Unplanned,2019,R,29 Mar 2019,109 min,"Biography, Drama","Chuck Konzelman, Cary Solomon","Abby Johnson, Chuck Konzelman, Cary Solomon","Ashley Bratcher, Brooks Ryan, Robia Scott","All Abby Johnson ever wanted to do was help women. As one of the youngest Planned Parenthood clinic directors in the nation, she believed in a woman's right to choose. Until the day she saw something that changed everything.",English,United States,6 wins & 3 nominations total,https://m.media-amazon.com/images/M/MV5BNzBjMjQ1YTAtYmMwMy00YTk0LTlmNDUtNDI4YjY0MmExZjI3XkEyXkFqcGc@._V1_SX300.jpg,10,5.5,"12,015",tt9024106,movie,N/A,"$19,005,109",N/A,N/A,True,5.5/10,,42%,10/100,,,,
Diane,1975,N/A,09 Jul 1975,97 min,Drama,Alan Clarke,Anthony Read,"Janine Duvitski, Frank Mills, Paul Copley","Teenager Diane Weaver lives with her abusive single father. A religious local boy is the only who wants to be her friend, but she doesn't like him as much as he does her. What no one realizes is how far the abuse goes.",English,United Kingdom,N/A,https://m.media-amazon.com/images/M/MV5BYzQ4YzY5Y2YtYmI1MC00NzhlLTgxZTctYTllZWI0NTA5NjVkXkEyXkFqcGdeQXVyMDY4MzkyNw@@._V1_SX300.jpg,N/A,N/A,77,tt0167118,episode,,,,,True,,,,,2,3,tt0762803,
Diane,2022,N/A,10 May 2022,80 min,Thriller,Damarrus Grant,Damarrus Grant,"Lucia Oskerova, Damarrus Grant, Brandee Smith","A young couple have somehow managed to move into their dream apartment, after being evicted from their last place. On the day the move in, they are greeted by Diane Harris, a beautiful and charming property manager who owns the build",English,United States,N/A,N/A,N/A,N/A,N/A,tt15382086,movie,N/A,N/A,N/A,N/A,True,,,,,,,,
Diane,2018,Not Rated,29 Mar 2019,95 min,Drama,Kent Jones,Kent Jones,"Mary Kay Place, Jake Lacy, Estelle Parsons","Diane fills her days helping others and desperately attempting to bond with her drug-addicted son. As these pieces of her existence begin to fade, she finds herself confronting memories she'd sooner forget than face.",English,United States,9 wins & 20 nominations,https://m.media-amazon.com/images/M/MV5BNGUxNDAxZDAtYWE0Yy00NWRmLWJhNTYtMWRlZDU1NTg2MjA0XkEyXkFqcGc@._V1_SX300.jpg,86,6.7,"1,687",tt6705860,movie,N/A,"$336,166",N/A,N/A,True,6.7/10,,93%,86/100,,,,
Screwball,2018,N/A,29 Mar 2019,105 min,"Documentary, History",Billy Corben,"Billy Corben, David Cypkin","Frankie Diaz, Bryan Blanco, Ian Mackles",Billy Corben's true-crime dramedy investigates the MLB's infamous doping scandal involving a nefarious clinician and his most famous client: the New York Yankees' Alex Rodriguez.,English,United States,2 wins & 1 nomination,https://m.media-amazon.com/images/M/MV5BNzE1ZWE1ZjYtMWRmYy00ZDhkLWIzMjEtZmUzYmMyNmRkZTIyXkEyXkFqcGc@._V1_SX300.jpg,72,7.2,"1,844",tt8819596,movie,N/A,"$13,967",N/A,N/A,True,7.2/10,,93%,72/100,,,,
Diane,2017,Not Rated,28 Oct 2017,82 min,"Crime, Drama, Horror",Michael Mongillo,"Matt Giannini, Michael Mongillo","Jason Alan Smith, Carlee Avers, Margaret Rose Champagne","When a disabled war veteran discovers the dead body of a beautiful singer in his back yard, his fascination with her photographic image soon turns to obsession.",English,United States,2 nominations,https://m.media-amazon.com/images/M/MV5BZGQzMWQ1ZGUtYTBhZC00ZjJmLThkMGEtZjc0YmE2ZmVkOTI0XkEyXkFqcGdeQXVyMjc3NDE2MA@@._V1_SX300.jpg,N/A,4.2,"1,619",tt3021984,movie,N/A,N/A,N/A,N/A,True,4.2/10,,93%,,,,,
,,,,,,,,,,,,,,,,,,,,,,,False,,Incorrect IMDb ID.,,,,,,
Us,2016,N/A,N/A,18 min,"Short, Drama",Caroline Stucky,Caroline Stucky,"Alice Kremelberg, Melody Cheng, Margaret Thornhill","Jo is an outgoing, liberated second generation Chinese-American girl who begins a passionate romance with Helen at the opening of the film. Since long before dating Helen, Jo has been extravagantly out and on the scene as a lesbia...",English,United States,N/A,https://m.media-amazon.com/images/M/MV5BYjk3MGVlYzEtNzU1Mi00YjRkLWExNDctMzIwMDRjOWNlNDY2XkEyXkFqcGc@._V1_SX300.jpg,N/A,N/A,9,tt5820488,movie,N/A,N/A,N/A,N/A,True,,,,,,,,
Us,1991,N/A,20 Sep 1991,93 min,Drama,Michael Landon,Michael Landon,"Michael Landon, Barney Martin, Casey Peterson","In 1972, Jeff Hayes was tried and convicted of killing the wife of a wealthy businessman. 18 years later, a detective reopened the case and discovers a necklace that was labeled as missing evidence and he discovers Jeff was innoce...",English,United States,N/A,https://m.media-amazon.com/images/M/MV5BMjZjNTQ1NTQtNDcyNi00NzhhLTk4ODEtNzIyMGZmNGE1N2MzXkEyXkFqcGc@._V1_SX300.jpg,N/A,7.1,232,tt0103181,movie,N/A,N/A,N/A,N/A,True,7.1/10,,,,,,,
Us,2017,N/A,21 Oct 2017,15 min,"Short, Comedy, Drama",Jessica Fuh,Jessica Fuh,"Bennett Abara, G Davis, Christine Weatherup",Two gay-straight best friends find their relationship tested when one gets a new girlfriend.,English,United States,N/A,https://m.media-amazon.com/images/M/MV5BMzE2MjQ0MzktMDc2ZC00ZTZkLThjODMtMTdhZmJhMzBlZTI1XkEyXkFqcGc@._V1_SX300.jpg,N/A,N/A,7,tt5953130,movie,N/A,N/A,N/A,N/A,True,,,,,,,,
