Title,Year,Rated,Released,Runtime,Genre,Director,Writer,Actors,Plot,Language,Country,Awards,Poster,Metascore,imdbRating,imdbVotes,imdbID,Type,DVD,BoxOffice,Production,Website,Response,Rating_InternetMovieDatabase,Error,Rating_RottenTomatoes,Rating_Metacritic,Season,Episode,seriesID,totalSeasons
The Disaster Artist,2017,R,08 Dec 2017,104 min,"Biography, Comedy, Drama",James Franco,"Scott Neustadter, Michael H. Weber, Greg Sestero","Dave Franco, James Franco, Seth Rogen","When aspiring actor Greg Sestero meets the weird and mysterious Tommy Wiseau in an acting class, they form a unique friendship and travel to Hollywood to make their dreams come true.",English,United States,Nominated for 1 Oscar. 32 wins & 84 nominations total,https://m.media-amazon.com/images/M/MV5BMmZlMjUxZDktNGNjYS00NmI2LWFhYTAtOGY2MjQwNTM1M2U4XkEyXkFqcGc@._V1_SX300.jpg,76,7.3,"170,044",tt3521126,movie,N/A,"$21,120,616",N/A,N/A,True,7.3/10,,90%,76/100,,,,
Gold,2020,N/A,12 Dec 2020,24 min,"Short, Comedy, Drama",Luca Pizzoleo,Luca Pizzoleo,"Raz Fritz, Lucio Nieto, Jamie Shelnitz","""Gold"" follows a young actor named Dean Douglas Cooper, who moves to Los Angeles to pursue his dreams of making it big. When things don't work out, Dean finds himself in an unusual situation: dressed in a gold suit and busking on ...",English,United States,10 wins & 13 nominations total,https://m.media-amazon.com/images/M/MV5BMDI4NDZjNGQtNDdjMi00MDAyLTg0ZTYtZjI1NGU1MmYxYTM0XkEyXkFqcGc@._V1_SX300.jpg,N/A,N/A,18,tt11355250,movie,N/A,N/A,N/A,N/A,True,,,,,,,,
Badsville,2001,N/A,N/A,N/A,N/A,P.J. Wolff,P.J. Wolff,"Rick Ballard, Danny Carey, Patrick Dean, Taime Downe",N/A,English,"USA, Canada",N/A,N/A,N/A,N/A,N/A,tt0388750,movie,N/A,N/A,N/A,N/A,True,,,,,,,,
Badsville,2017,N/A,07 Apr 2021,99 min,"Action, Drama, Romance",April Mullen,"Benjamin Barrett, Ian McLaren","Ian McLaren, Benjamin Barrett, Tamara Duarte",A violent greaser gang is ripped apart when their leader finds love and is determined to leave Badsville - a town where love doesn't exist.,English,"United States, Canada",9 wins & 17 nominations,https://m.media-amazon.com/images/M/MV5BYmM5MGZlMTItN2ViYS00NmQ2LWI2Y2QtNGY0NzMzZmQyMGIxXkEyXkFqcGc@._V1_SX300.jpg,N/A,5.3,206,tt4843618,movie,N/A,"$4,153",N/A,N/A,True,5.3/10,,,,,,,
,,,,,,,,,,,,,,,,,,,,,,,False,,Incorrect IMDb ID.,,,,,,
Gold,2019,N/A,01 Sep 2019,4 min,"Short, Horror, Thriller",Gi Sebastienne Giyan Gonzales,Gi Sebastienne Giyan Gonzales,"Dhante Bunbury, Jenna Choi, Jamil Garland",Five high school kids are approached by a stranger from their school to play a twisted game of odds.,English,United States,1 win,https://m.media-amazon.com/images/M/MV5BM2ZiZmNmZjAtNWNjZS00NWQzLTk5NjgtMjYwMThjYWZjMWFiXkEyXkFqcGdeQXVyMTA2MzEyNDg0._V1_SX300.jpg,N/A,N/A,N/A,tt11416100,movie,N/A,N/A,N/A,N/A,True,,,,,,,,
Gold,2022,N/A,N/A,27 min,Short,Charles Francis Solomon,Emmanuel Mang Eme,"Uche Elumelu, Udoka Njoku, Eric Obinna","The joy of a family seeing the Super Eagles of Nigeria win ""Gold"" against big teams in Atlanta '96 Olympics despite the odds stacked against them would seem like the long-awaited hope that the country needs.",English,United States,N/A,https://m.media-amazon.com/images/M/MV5BMzJkNTk4NTAtMGY3Zi00ZDNkLWE2ZjAtYmI2MGY2NzYwNWZiXkEyXkFqcGdeQXVyMTUzMDQyMTA4._V1_SX300.jpg,N/A,N/A,N/A,tt20416000,movie,N/A,N/A,N/A,N/A,True,,,65%,,,,,
Gold,1989,N/A,22 Aug 1989,45 min,Documentary,Caroline Maynard,N/A,"David Jessel, Kate Adie, Brian Boyce",N/A,English,United Kingdom,N/A,https://m.media-amazon.com/images/M/MV5BNjUyY2NjMzEtOTBmMS00NGViLTg4MzctMGFjMzBlYTQ5ZmFiXkEyXkFqcGc@._V1_SX300.jpg,N/A,N/A,N/A,tt34378587,movie,N/A,N/A,N/A,N/A,True,,,,,,,,
Call Me by Your Name,2017,R,19 Jan 2018,132 min,"Drama, Romance",Luca Guadagnino,"James Ivory, André Aciman","Timothée Chalamet, Armie Hammer, Michael Stuhlbarg","In the summer of 1983, 17-year-old Elio is spending the days with his family at their villa in Lombardy, Italy. He soon meets 24-year-old Oliver, an intern working for Elio's father. They discover the heady beauty of awakening des...","English, Italian, French, German, Hebrew","Brazil, France, Italy, United States",Won 1 Oscar. 107 wins & 263 nominations total,https://m.media-amazon.com/images/M/MV5BNDk3NTEwNjc0MV5BMl5BanBnXkFtZTgwNzYxNTMwMzI@._V1_SX300.jpg,94,7.8,"347,929",tt5726616,movie,N/A,"$18,095,701",N/A,N/A,True,7.8/10,,95%,94/100,,,,
The Star,1952,Approved,11 Dec 1952,89 min,"Drama, Romance",Stuart Heisler,"Dale Eunson, Katherine Albert","Bette Davis, Sterling Hayden, Natalie Wood","A washed-up movie queen finds romance, but still desires a comeback.",English,United States,Nominated for 1 Oscar. 1 nomination total,https://m.media-amazon.com/images/M/MV5BM2E2N2ZhYmEtNzgxYi00OGNmLWIyMzAtMTEyZThkYmUxNjQzXkEyXkFqcGc@._V1_SX300.jpg,54,7.0,"4,219",tt0045186,movie,N/A,N/A,N/A,N/A,True,7.0/10,,25%,54/100,,,,
Wonder,2017,PG,17 Nov 2017,113 min,"Drama, Family",Stephen Chbosky,"Stephen Chbosky, Steve Conrad, Jack Thorne","Jacob Tremblay, Owen Wilson, Izabela Vidovic","Based on the New York Times bestseller, this movie tells the incredibly inspiring and heartwarming story of August Pullman, a boy with facial differences who enters the fifth grade, attending a mainstream elementary school for the...",English,"United States, Hong Kong, Canada",Nominated for 1 Oscar. 5 wins & 28 nominations total,https://m.media-amazon.com/images/M/MV5BYmFkYTlhNWUtMzliMS00ODIyLThlMmUtOGQ0N2RmOTg4YjJiXkEyXkFqcGc@._V1_SX300.jpg,66,7.9,"192,483",tt2543472,movie,N/A,"$132,422,809",N/A,N/A,True,7.9/10,,86%,66/100,,,,
Justice League,2017,PG-13,17 Nov 2017,120 min,"Action, Adventure, Fantasy",Zack Snyder,"Jerry Siegel, Joe Shuster, Chris Terrio","Ben Affleck, Gal Gadot, Jason Momoa","Steppenwolf and his Parademons return after eons to capture Earth. However, Batman seeks the help of Wonder Woman to recruit and assemble Flash, Cyborg and Aquaman to fight the powerful new enemy.","English, Irish Gaelic, Russian, Icelandic","United States, Canada, United Kingdom",2 wins & 15 nominations total,https://m.media-amazon.com/images/M/MV5BMjM5YmQxM2YtZjI2Yy00YjhhLTg5N2MtMTEyMzdlZDU3OTVhXkEyXkFqcGc@._V1_SX300.jpg,45,6.0,"497,511",tt0974015,movie,N/A,"$229,024,295",N/A,N/A,True,6.0/10,,39%,45/100,,,,
,,,,,,,,,,,,,,,,,,,,,,,False,,Incorrect IMDb ID.,,,,,,
The Breadwinner,2017,PG-13,17 Nov 2017,94 min,"Animation, Drama, War",Nora Twomey,"Anita Doron, Deborah Ellis","Saara Chaudry, Soma Chhaya, Noorin Gulamgaus","In 2001, Afghanistan is under the control of the Taliban. When her father is captured, a determined young girl disguises herself as a boy in order to provide for her family.",English,"Ireland, Canada, Luxembourg, United States, France",Nominated for 1 Oscar. 24 wins & 55 nominations total,https://m.media-amazon.com/images/M/MV5BYzlhMTkzYTYtOTBiZC00NzE4LWJlM2MtMmEwMWIxNTg3YjRkXkEyXkFqcGc@._V1_SX300.jpg,78,7.7,"29,866",tt3901826,movie,N/A,"$313,215",N/A,N/A,True,7.7/10,,95%,78/100,,,,
The Star,2012,N/A,10 Aug 2012,15 min,"Short, Drama",Nikola Todorovic,Dom Huynh,"T'Lane Balue, Evan Rhoda, Holly Lynn Yarmosh",A young man tries to reconnect with the girl he once loved after discovering she has given up on her acting career and entered the adult entertainment industry.,English,United States,1 nomination,N/A,N/A,N/A,N/A,tt2338404,movie,N/A,N/A,N/A,N/A,True,,,,,,,,
The Star,2017,PG,17 Nov 2017,86 min,"Animation, Adventure, Comedy",Timothy Reckart,"Carlos Kotkin, Simon Moore","Steven Yeun, Keegan-Michael Key, Aidy Bryant",A small but brave donkey and his animal friends become the unsung heroes of the first Christmas.,English,United States,2 wins & 6 nominations total,https://m.media-amazon.com/images/M/MV5BMTU4MDQ4NTM2N15BMl5BanBnXkFtZTgwNDM1NTIzMzI@._V1_SX300.jpg,42,6.3,"10,328",tt4587656,movie,N/A,"$40,896,334",N/A,N/A,True,6.3/10,,45%,42/100,,,,
Wonder,2019,TV-MA,20 Jul 2019,16 min,"Short, Drama, Family",Javier Molina,Gabriel Furman,"Benji Siegel, Nico Bustamante, Farrah Faucette",An 11-year-old kid growing up in the hood secretly dreams of trick-or-treating as a female super hero for Halloween.,English,United States,14 wins & 4 nominations,https://m.media-amazon.com/images/M/MV5BMDA4ZDM4ODAtY2RmMC00OTY3LWJmNzUtY2M5NWIwZWEyNWIyXkEyXkFqcGdeQXVyMTU1NTE5NTA@._V1_SX300.jpg,N/A,7.8,100,tt9129922,movie,N/A,N/A,N/A,N/A,True,7.8/10,,,,,,,
The Star,1998,N/A,N/A,N/A,Short,David Moore,N/A,N/A,N/A,N/A,N/A,N/A,N/A,N/A,N/A,N/A,tt0259596,movie,N/A,N/A,N/A,N/A,True,,,,,,,,
No Greater Love,2010,PG,14 May 2010,109 min,"Drama, Romance",Brad J. Silverman,"Brad J. Silverman, James Killian, Elizabeth Killian","Anthony Tyler Quinn, Danielle Bisutti, Jay Underwood","Jeff and Heather Baker were life long sweethearts and happily married... for a time. But at her greatest moment of weakness, Heather abandons Jeff, forcing Jeff to raise their young son alone. Ten years later, through a God ordain...",English,United States,N/A,https://m.media-amazon.com/images/M/MV5BMTU3MjI4ODA0Ml5BMl5BanBnXkFtZTcwODAwNTcxMw@@._V1_SX300.jpg,N/A,5.9,513,tt1225703,movie,N/A,N/A,N/A,N/A,True,5.9/10,,,,,,,
,,,,,,,,,,,,,,,,,,,,,,,False,,Incorrect IMDb ID.,,,,,,
Murder on the Orient Express,2017,PG-13,10 Nov 2017,114 min,"Comedy, Crime, Drama",Kenneth Branagh,"Michael Green, Agatha Christie","Paapa Essiedu, Yassine Zeroual, Asan N'Jie","When a murder occurs aboard the train on which he's travelling, celebrated Belgian detective Hercule Poirot is recruited to solve the case.","English, French, Turkish, German, Arabic","United States, United Kingdom, Malta",2 wins & 31 nominations total,https://m.media-amazon.com/images/M/MV5BNTlkYjBlZTctZjg2YS00NDMzLTlkMTMtNWExMGYyOTliMmEzXkEyXkFqcGc@._V1_SX300.jpg,52,6.5,"316,177",tt3402236,movie,N/A,"$102,826,543",N/A,N/A,True,6.5/10,,60%,52/100,,,,
Murder on the Orient Express,2001,N/A,22 Apr 2001,100 min,"Crime, Drama, Mystery",Carl Schenkel,"Agatha Christie, Stephen Harrigan","Alfred Molina, Meredith Baxter, Leslie Caron","Hercule Poirot, now in modern times, investigates the famous crime on the famed train with a modern twist.","French, Turkish, German, Serbo-Croatian, English",United States,N/A,https://m.media-amazon.com/images/M/MV5BYzQ3Y2VlNzItZjU5OS00Mzg2LWE0N2UtMTA2ZTM2ZGYzNjVlXkEyXkFqcGc@._V1_SX300.jpg,N/A,5.1,"1,193",tt0279250,movie,N/A,N/A,N/A,N/A,True,5.1/10,,,,,,,
No Greater Love,1960,N/A,N/A,30 min,"Short, Drama",Jan Sadlo,Donald Johnson,"Richard Denning, Evelyn Ankers, Art Linkletter",A dentist and his wife join Christian missionaries for duty in Africa.,English,United States,N/A,https://m.media-amazon.com/images/M/MV5BMGVhMjhlNjYtZWM0My00NGQyLWEyMDUtZWQxNDg3ZTZhYjg0XkEyXkFqcGdeQXVyODUyMTkwOTg@._V1_SX300.jpg,N/A,N/A,N/A,tt0141662,movie,N/A,N/A,N/A,N/A,True,,,,,,,,
Thelma,2024,PG-13,21 Jun 2024,98 min,"Action, Comedy",Josh Margolin,Josh Margolin,"June Squibb, Fred Hechinger, Parker Posey","When 93-year-old Thelma Post gets duped by a phone scammer pretending to be her grandson, she sets out on a treacherous quest across the city to reclaim what was taken from her.",English,"United States, Switzerland",11 wins & 29 nominations total,https://m.media-amazon.com/images/M/MV5BNmE4OTc5ODAtMmEyOC00NTY5LWE5MGEtMDhkZjhiNzNhY2VjXkEyXkFqcGc@._V1_SX300.jpg,77,7.0,"26,351",tt23778968,movie,N/A,"$9,002,073",N/A,N/A,True,7.0/10,,98%,77/100,,,,
Murder on the Orient Express,1974,PG,24 Nov 1974,128 min,"Crime, Drama, Mystery",Sidney Lumet,"Agatha Christie, Paul Dehn, Anthony Shaffer","Albert Finney, Lauren Bacall, Martin Balsam","Returning home from Istanbul on the Orient Express, renowned Belgian detective Hercule Poirot is called upon to solve the murder of an American businessman aboard the train. The suspects are numerous and the clues confusing.","English, French, German, Turkish, Italian, Swedish, Hungarian",United Kingdom,Won 1 Oscar. 10 wins & 17 nominations total,https://m.media-amazon.com/images/M/MV5BNzZmZWMwOWUtM2NkZS00MWM0LTk1YzMtYzI4OGYyMTNlNTMwXkEyXkFqcGc@._V1_SX300.jpg,62,7.2,"73,264",tt0071877,movie,N/A,"$27,634,716",N/A,N/A,True,7.2/10,,89%,62/100,,,,
No Greater Love,1995,TV-PG,01 Jan 1996,105 min,"Drama, Romance",Richard T. Heffron,"Carmen Culver, Danielle Steel","Kelly Rutherford, Chris Sarandon, Nicholas Campbell",A woman (Kelly Rutherford) who loses her fiance and her parents in the Titanic disaster neglects her own needs to care for her brothers and sister.,English,United States,N/A,https://m.media-amazon.com/images/M/MV5BNTE3OTIwNTA0MF5BMl5BanBnXkFtZTcwNTk5ODQyMQ@@._V1_SX300.jpg,N/A,5.8,504,tt0117190,movie,N/A,N/A,N/A,N/A,True,5.8/10,,,,,,,
No Greater Love,2015,TV-14,10 Nov 2017,94 min,Documentary,Justin Roberts,"Justin Roberts, Alan Wain","Gene Delgado, Jameson Lindskog","No Greater Love explores a combat deployment through the eyes of an Army chaplain, as he and his men fight their way through a hellish tour in one of the most dangerous places in Afghanistan and then as they struggle to reintegrat...",English,"United States, Afghanistan",9 wins,https://m.media-amazon.com/images/M/MV5BYjhhODIzYjUtYWJhYi00MGEyLWI4ZjQtMzA3YTY0OTZhM2YxXkEyXkFqcGc@._V1_SX300.jpg,85,7.3,249,tt4687782,movie,N/A,"$30,247",N/A,N/A,True,7.3/10,,100%,85/100,,,,
No Greater Love,2009,N/A,29 Dec 2010,100 min,Documentary,Michael Whyte,N/A,"Mary of St. Philip, Mary of the Immaculate Conception, Mary of Christ","View the pace of life at the Monastery of the Most Holy Trinity in Notting Hill, home to a cloistered order of Carmelite nuns.",English,United Kingdom,N/A,https://m.media-amazon.com/images/M/MV5BMTk2ODc0NTAwMV5BMl5BanBnXkFtZTcwMzU5NzYzNw@@._V1_SX300.jpg,N/A,7.4,66,tt1438204,movie,N/A,N/A,N/A,N/A,True,7.4/10,,,,,,,
No Greater Love,2005,Not Rated,22 Sep 2005,17 min,"Short, Drama",Arthur Rasco,"Arthur Rasco, Hanna Rasco, Michael Scranton","Michael Scranton, Becca Daugherty, Kathryn Alloway Page","Based on true events, this award-winning short drama contrasts one man's dedication to his family to another's search for meaning in life.",English,United States,N/A,https://m.media-amazon.com/images/M/MV5BMTM3NDg2NzI1MV5BMl5BanBnXkFtZTcwNDgyOTc0MQ@@._V1_SX300.jpg,N/A,7.2,11,tt0796337,movie,N/A,N/A,N/A,N/A,True,7.2/10,,,,,,,
Painted Woman,2017,Not Rated,10 Nov 2017,108 min,"Romance, Western",James Cotten,"James Cotten, Amber Lindley, Dusty Richards","Stef Dawson, Matt Dallas, Kiowa Gordon","Julie's time with her benefactor, Kyle Allison, is coming to a dangerous close, but she is given two chances of escape from two very different men - a hired assassin and a wayward horse trainer with a dark past. Which man will sav...",English,United States,10 wins & 5 nominations,https://m.media-amazon.com/images/M/MV5BYzNhODI3MzMtZTVkMS00MjQ2LTkxMzgtMmU4MmUxZDI4NDBiXkEyXkFqcGdeQXVyNDgwMDgxMg@@._V1_SX300.jpg,N/A,5.5,"2,115",tt6281242,movie,N/A,"$10,298",N/A,N/A,True,5.5/10,,,,,,,
LBJ,2016,R,03 Nov 2017,98 min,"Biography, Drama, History",Rob Reiner,Joey Hartstone,"Woody Harrelson, Michael Stahl-David, Richard Jenkins","Lyndon B. Johnson aligns himself with John F. Kennedy, rises to the Presidency, and deals with the civil rights struggles of the 1960s.",English,United States,1 nomination total,https://m.media-amazon.com/images/M/MV5BMzM2Njg5NDU4MF5BMl5BanBnXkFtZTgwMDMwMTQ1MzI@._V1_SX300.jpg,54,6.5,"7,988",tt4778988,movie,N/A,"$2,470,979",N/A,N/A,True,6.5/10,,55%,54/100,,,,
,,,,,,,,,,,,,,,,,,,,,,,False,,Incorrect IMDb ID.,,,,,,
Lady Bird,2017,R,01 Dec 2017,94 min,"Comedy, Drama",Greta Gerwig,Greta Gerwig,"Saoirse Ronan, Laurie Metcalf, Tracy Letts","A fiercely independent teenager tries to make her own way in the world while wanting to get out of her hometown of Sacramento, California, and to get away from her complicated mother and recently-unemployed father.","English, Spanish",United States,Nominated for 5 Oscars. 124 wins & 228 nominations total,https://m.media-amazon.com/images/M/MV5BNjk5MzcyOWQtNzE1Mi00NzdmLTlkM2QtOTdjZThhMDc2Y2NjXkEyXkFqcGc@._V1_SX300.jpg,93,7.4,"356,429",tt4925292,movie,N/A,"$48,958,273",N/A,N/A,True,7.4/10,,99%,93/100,,,,
A Bad Moms Christmas,2017,R,01 Nov 2017,104 min,Comedy,"Jon Lucas, Scott Moore","Jon Lucas, Scott Moore","Mila Kunis, Kristen Bell, Kathryn Hahn","As their own mothers drop in unexpectedly, our three under-appreciated and over-burdened moms rebel against the challenges and expectations of the Super Bowl for mothers: Christmas.","English, Japanese","United States, China",1 win & 1 nomination total,https://m.media-amazon.com/images/M/MV5BMTUwNTA4MDMxNl5BMl5BanBnXkFtZTgwMjE4NjQ0MzI@._V1_SX300.jpg,42,5.6,"61,011",tt6359956,movie,N/A,"$72,110,659",N/A,N/A,True,5.6/10,,32%,42/100,,,,
Keep Watching,2017,R,31 Oct 2017,89 min,"Horror, Mystery, Thriller",Sean Carter,Joseph Dembner,"Bella Thorne, Chandler Riggs, Ioan Gruffudd",A family become imprisoned in their home by intruders who force them to play a life and death game where the mysterious rules become clear as the night unfolds.,English,United States,N/A,https://m.media-amazon.com/images/M/MV5BZWQyODc2NTctZjhkMC00MGY1LThkY2YtMmY1ZTM0ZjgwYmYxXkEyXkFqcGc@._V1_SX300.jpg,N/A,4.3,"5,054",tt2531334,movie,N/A,"$94,178",N/A,N/A,True,4.3/10,,,,,,,
Amityville: The Awakening,2017,PG-13,12 Oct 2017,87 min,"Horror, Thriller",Franck Khalfoun,Franck Khalfoun,"Jennifer Jason Leigh, Bella Thorne, Mckenna Grace","A desperate single mother moves with her three children into the notorious, supposedly haunted, real-life Amityville house to try and use its dark powers to cure her comatose son. Things go horribly wrong.",English,"United States, United Kingdom",1 nomination total,https://m.media-amazon.com/images/M/MV5BMjQwOTI3Nzk5OV5BMl5BanBnXkFtZTgwMzY3NDMyODE@._V1_SX300.jpg,42,4.8,"16,426",tt1935897,movie,N/A,$742,N/A,N/A,True,4.8/10,,29%,42/100,,,,
,,,,,,,,,,,,,,,,,,,,,,,False,,Incorrect IMDb ID.,,,,,,
All I See Is You,2016,R,27 Oct 2017,109 min,"Drama, Mystery",Marc Forster,"Sean Conway, Marc Forster","Blake Lively, Jason Clarke, Ahna O'Reilly",A blind woman's relationship with her husband changes when she regains her sight and discovers disturbing details about themselves.,English,"United States, Thailand",1 nomination total,https://m.media-amazon.com/images/M/MV5BNDI5NzU2OTM1MV5BMl5BanBnXkFtZTgwNzU3NzM3MzI@._V1_SX300.jpg,43,5.4,"13,951",tt4486986,movie,N/A,"$217,644",N/A,N/A,True,5.4/10,,30%,43/100,,,,
Jigsaw,2002,R,22 Oct 2002,78 min,"Horror, Sci-Fi, Thriller","Don Adams, Harry James Picardi","Don Adams, Harry James Picardi","Barret Walz, Aimee Bravo, Mia Zifkin, Arthur Simone",A group of art students working on their final project soon learn that putting a little of themselves into their work can be a bad thing.,English,USA,N/A,https://m.media-amazon.com/images/M/MV5BMTQyNzExODY1NF5BMl5BanBnXkFtZTcwOTg1MDgxMQ@@._V1_SX300.jpg,N/A,3.3,485,tt0330489,movie,N/A,N/A,N/A,N/A,True,3.3/10,,,,,,,
Jigsaw,1962,Not Rated,16 Oct 1963,97 min,"Crime, Drama, Mystery",Val Guest,"Hillary Waugh, Val Guest","Jack Warner, Ronald Lewis, Yolande Donlan",A woman is found murdered in a house along the coast from Brighton. Local detectives Fellows and Wilks lead an investigation methodically following up leads and clues mostly in Brighton and Hove but also further afield.,English,United Kingdom,N/A,https://m.media-amazon.com/images/M/MV5BNjBhZTVmNGQtMjdlZi00MTA4LWEzNmItNGM2ZGZhYmM1NjYwXkEyXkFqcGc@._V1_SX300.jpg,N/A,7.2,"1,709",tt0056121,movie,N/A,N/A,N/A,N/A,True,7.2/10,,,,,,,
Jigsaw,1990,N/A,N/A,89 min,N/A,Marc Gracie,"Marc Gracie, Chris Thompson","Rebecca Gibney, Michael Coard, Dominique Sweeney",Virginia York's husband is killed on the first day of their honeymoon and she is the prime suspect,English,Australia,N/A,https://m.media-amazon.com/images/M/MV5BZWZhZjhiMTYtZDZlMC00ZmVjLTlkMzgtMmY3ZjllZDI3Y2IzXkEyXkFqcGdeQXVyMDM3ODU0Nw@@._V1_SX300.jpg,N/A,4.6,21,tt0099882,movie,N/A,N/A,N/A,N/A,True,4.6/10,,,,,,,
Thank You for Your Service,2015,N/A,16 Sep 2016,88 min,"Documentary, Drama",Tom Donahue,N/A,"Mark Russell, Mike Mullen, Robert Gates",An investigation into the failed mental health policies within the US military and the deadly consequences to the troops.,English,United States,1 nomination,https://m.media-amazon.com/images/M/MV5BMTczOTE5OTkyM15BMl5BanBnXkFtZTgwODg4NTkyNzE@._V1_SX300.jpg,N/A,7.5,121,tt2352196,movie,N/A,"$21,497",N/A,N/A,True,7.5/10,,,,,,,
Jigsaw,1968,Approved,07 Jun 1968,97 min,"Mystery, Thriller",James Goldstone,"Ranald MacDougall, Peter Stone, Howard Fast","Harry Guardino, Bradford Dillman, Hope Lange","After inadvertently ingesting some sugar laced with LSD, a man wakes up with amnesia and in the middle of a murder plot.",English,United States,N/A,https://m.media-amazon.com/images/M/MV5BYmZmY2M4ZjQtZWJkMi00NTNmLTlhYjgtZTAzMWI4ZjZiZTM5XkEyXkFqcGc@._V1_SX300.jpg,N/A,5.7,196,tt0063155,movie,N/A,N/A,N/A,N/A,True,5.7/10,,,,,,,
Jigsaw,1972,N/A,26 Mar 1972,100 min,"Crime, Drama",William A. Graham,Robert E. Thompson,"James Wainwright, Vera Miles, Andrew Duggan",A detective specializing in missing persons cases is accused of murder after being found unconscious in the apartment of a murdered state official.,English,United States,N/A,https://m.media-amazon.com/images/M/MV5BYTVkOTQwZGUtMDdmMi00OGUwLWJkMmYtOTllNzQ2MWZkY2E3XkEyXkFqcGdeQXVyNzcyMzM5NjA@._V1_SX300.jpg,N/A,7.6,24,tt0067271,movie,N/A,N/A,N/A,N/A,True,7.6/10,,,,,,,
Jigsaw,1949,Passed,11 Mar 1949,72 min,"Crime, Drama, Film-Noir",Fletcher Markle,"Fletcher Markle, Vincent McConnor, John Roeburt","Franchot Tone, Jean Wallace, Myron McCormick",New York Assistant District Attorney Howard Malloy investigates a series of murders and uncovers an extremist group.,English,United States,N/A,https://m.media-amazon.com/images/M/MV5BYjc0ZmEwOTUtNDE5Ni00YWM1LWE0NmQtYjc1NzRkZTU0ZmZjXkEyXkFqcGdeQXVyMTY5Nzc4MDY@._V1_SX300.jpg,N/A,5.6,962,tt0041523,movie,N/A,N/A,N/A,N/A,True,5.6/10,,,,,,,
,,,,,,,,,,,,,,,,,,,,,,,False,,Incorrect IMDb ID.,,,,,,
Let There Be Light,1980,Not Rated,16 Dec 1980,58 min,"Documentary, War",John Huston,"John Huston, Charles Kaufman","Walter Huston, Benjamin Simon",A group of mentally traumatized veteran patients is followed as they go through psychiatric treatment.,English,United States,1 win,https://m.media-amazon.com/images/M/MV5BMmE1MmMwMzUtMGM1ZS00Mjg1LWFiMDYtODgxMTA5ZWM4YzQzXkEyXkFqcGdeQXVyMTY5Nzc4MDY@._V1_SX300.jpg,N/A,7.4,"1,998",tt0038687,movie,N/A,N/A,N/A,N/A,True,7.4/10,,86%,,,,,
Jigsaw,2017,R,27 Oct 2017,92 min,"Horror, Mystery, Thriller","Michael Spierig, Peter Spierig","Josh Stolberg, Pete Goldfinger","Matt Passmore, Tobin Bell, Callum Keith Rennie",Police search for a supposed to be dead killer who forces his victims to play sadistic games of life and death.,English,"United States, Canada",N/A,https://m.media-amazon.com/images/M/MV5BZDk1ZTk1ZGYtNmViOS00NDExLTg0NTktMGZjYzg2ZDJlNmViXkEyXkFqcGc@._V1_SX300.jpg,39,5.7,"99,346",tt3348730,movie,N/A,"$38,052,832",N/A,N/A,True,5.7/10,,32%,39/100,,,,
Thank You for Your Service,2017,R,27 Oct 2017,109 min,"Biography, Drama, War",Jason Hall,"David Finkel, Jason Hall","Miles Teller, Beulah Koale, Joe Cole","A group of U.S. soldiers returning from Iraq struggle to integrate back into family and civilian life, while living with the memory of a war that threatens to destroy them long after they've left the battlefield.",English,"United States, India",1 win & 1 nomination total,https://m.media-amazon.com/images/M/MV5BMTA0NTM5NzgzMjJeQTJeQWpwZ15BbWU4MDAwODc3NjIy._V1_SX300.jpg,68,6.6,"16,363",tt2776878,movie,N/A,"$9,536,300",N/A,N/A,True,6.6/10,,77%,68/100,,,,
Let There Be Light,2021,N/A,09 Sep 2021,N/A,"Short, Drama",Jon K. Jones,Jon K. Jones,"Naomë Antoinette, Doron JePaul Mitchell","A portrait of African-American inventor, engineer, poet, artist, and American Civil War veteran, Lewis H. Latimer told through the experiences of his wife, Mary.",English,United States,N/A,https://m.media-amazon.com/images/M/MV5BMjY3YmE3OGUtYzkzZi00ZmMzLThmMGYtYTA4YzdjMmM5MGQ4XkEyXkFqcGdeQXVyMTA4NTkwMzI0._V1_SX300.jpg,N/A,N/A,N/A,tt14971194,movie,N/A,N/A,N/A,N/A,True,,,,,,,,
Let There Be Light,2017,Not Rated,10 Mar 2017,80 min,Documentary,"Mila Aung-Thwin, Van Royko","Mila Aung-Thwin, Bob Moore","Mark Henderson, Jeffrey Harris, Michel Laberge","Let There Be Light follows the story of dedicated scientists working to build a small sun on Earth, which would unleash perpetual, cheap, clean energy for mankind. After decades of failed attempts, a massive push is now underway t...","English, French, German","Canada, France, Italy, Switzerland, United States",2 wins & 4 nominations,https://m.media-amazon.com/images/M/MV5BYmQ4ZTkxMTAtZjZhZi00ZjM0LWFiZGUtYjhiM2Q2MTg3ZmQ2XkEyXkFqcGdeQXVyMTE0MTUxMTQ@._V1_SX300.jpg,N/A,6.6,209,tt6184774,movie,N/A,N/A,N/A,N/A,True,6.6/10,,100%,,,,,
Suburbicon,2017,R,27 Oct 2017,105 min,"Comedy, Crime, Drama",George Clooney,"Joel Coen, Ethan Coen, George Clooney","Matt Damon, Julianne Moore, Oscar Isaac","As a 1950s suburban community self-destructs, a home invasion has sinister consequences for one seemingly normal family.",English,"United Kingdom, United States, China",4 wins & 8 nominations total,https://m.media-amazon.com/images/M/MV5BMjIxYzIyY2YtMDNjYS00ZGJkLWE0ZGYtMDMxNzJhZDZjYzI0XkEyXkFqcGc@._V1_SX300.jpg,42,5.8,"48,684",tt0491175,movie,N/A,"$5,775,178",N/A,N/A,True,5.8/10,,,42/100,,,,
Let There Be Light,2017,PG-13,03 Nov 2017,100 min,Drama,Kevin Sorbo,"Sam Sorbo, Dan Gordon","Kevin Sorbo, Sam Sorbo, Daniel Roebuck",An atheist goes through a near-death experience in a car accident before converting to Christianity.,English,United States,1 nomination total,https://m.media-amazon.com/images/M/MV5BZmI2N2QxYjgtYjE3OC00ZmY5LTgyNjktMzU3NzE5ZmE1MzYzXkEyXkFqcGc@._V1_SX300.jpg,N/A,4.6,"3,374",tt5804314,movie,N/A,"$7,233,471",N/A,N/A,True,4.6/10,,100%,,,,,
Let There Be Light,2016,N/A,N/A,52 min,Documentary,Supriyo Sen,Supriyo Sen,N/A,"The light art industry of Chandannagar originated in the sixties as small handicraft units to illuminate the Jagaddhatri Puja festival of the town. The diverse story ideas, unique innovations and creative execution, however, soon mad",Bengali,India,N/A,N/A,N/A,N/A,N/A,tt14593782,movie,N/A,N/A,N/A,N/A,True,,,,,,,,
