Title,Year,Rated,Released,Runtime,Genre,Director,Writer,Actors,Plot,Language,Country,Awards,Poster,Metascore,imdbRating,imdbVotes,imdbID,Type,DVD,BoxOffice,Production,Website,Response,Rating_InternetMovieDatabase,Rating_Metacritic,Error,Rating_RottenTomatoes,Season,Episode,seriesID,totalSeasons
Napoleon,2023,R,22 Nov 2023,158 min,"Action, Adventure, Biography",Ridley Scott,David Scarpa,"Joaquin Phoenix, Vanessa Kirby, Tahar Rahim","An epic that details the chequered rise and fall of French Emperor Napoleon Bonaparte and his relentless journey to power through the prism of his addictive, volatile relationship with his wife, Josephine.","English, French, Russian, German, Italian","United Kingdom, United States",Nominated for 3 Oscars. 6 wins & 47 nominations total,https://m.media-amazon.com/images/M/MV5BZGQ1NGUxNDUtNjg3Yi00ZTZjLWIwOTUtNDBjYWY5ZjVmZGI4XkEyXkFqcGc@._V1_SX300.jpg,64,6.3,"178,922",tt13287846,movie,N/A,"$61,524,375",N/A,N/A,True,6.3/10,64/100,,58%,,,,
Napoleon,1995,G,10 Oct 1997,81 min,"Adventure, Family",Mario Andreacchio,"Michael Bourchier, Mario Andreacchio, Mark Saltzman","Jamie Croft, Philip Quast, Susan Lyons","The adventures of Golden Retriever pup Napoleon and his friend, the parrot Birdo Lucci.",English,"Australia, Japan, United States",N/A,https://m.media-amazon.com/images/M/MV5BNjc0MTcyOTYyOV5BMl5BanBnXkFtZTcwMzMwOTc2NA@@._V1_SX300.jpg,N/A,6.0,"2,092",tt0113932,movie,N/A,N/A,N/A,N/A,True,6.0/10,,,,,,,
Napoleon,2000–,N/A,08 Nov 2000,240 min,"Documentary, Biography, History",N/A,N/A,David McCullough,Documentary about the rise and fall of one of the greatest military geniuses of modern times from his Corsican childhood to final exile in St. Helena.,English,United States,3 wins & 1 nomination,https://m.media-amazon.com/images/M/MV5BMTY2Njg3MDQ2OV5BMl5BanBnXkFtZTYwMzcyOTY5._V1_SX300.jpg,N/A,8.0,410,tt0266164,series,,,,,True,8.0/10,,,,,,,1
Monster,2019,N/A,17 Oct 2019,81 min,"Crime, Drama",Inderveer Sodhi,Inderveer Sodhi,"Inderveer Sodhi, Ivon Shiva Naicker, Shaun Gill","After losing his innocence, his best friend, and the love of his adolescence, this coming-of-age gangster drama follows Harman in an hour of his night within a new life of violence.",English,Canada,N/A,https://m.media-amazon.com/images/M/MV5BYjUwZTNmODUtMWFmYS00ZDY1LTg1YWItMmIxYTAyMWEwNDEyXkEyXkFqcGdeQXVyNTI2NzY5MjI@._V1_SX300.jpg,N/A,N/A,N/A,tt8071360,movie,N/A,N/A,N/A,N/A,True,,,,100%,,,,
Monster,2011,N/A,06 Dec 2011,N/A,"Short, Drama",Jamie Adams,Gregg Glover,"Keiron Self, Eiry Hughes, Holly Bailey",A comical short film about a family raising a spoilt daughter.,English,United Kingdom,N/A,https://m.media-amazon.com/images/M/MV5BOWE2ZDY3MWUtNjJhMy00ODRmLWE5ZGItYWU0N2JkNDVkYmY3XkEyXkFqcGdeQXVyMTU1NjQ0NDM@._V1_SX300.jpg,N/A,N/A,N/A,tt2185457,episode,,,,,True,,,,,3,5,tt2138674,
Monster,2005,N/A,23 Mar 2012,10 min,"Short, Horror, Thriller",Jennifer Kent,Jennifer Kent,"Susan Prior, Luke Ikimis-Healey, Trash Vaudeville","A mother battles with her son's fear of a monster lurking in the closet, but soon discovers a sinister presence all around her.",English,Australia,4 wins,https://m.media-amazon.com/images/M/MV5BMzNlNzQzYTAtYjM1Yi00N2I4LWI0OTYtYzNlZGQyYjMyOTUwXkEyXkFqcGc@._V1_SX300.jpg,N/A,6.8,"1,297",tt0466566,movie,N/A,N/A,N/A,N/A,True,6.8/10,,,,,,,
,,,,,,,,,,,,,,,,,,,,,,,False,,,Incorrect IMDb ID.,,,,,
,,,,,,,,,,,,,,,,,,,,,,,False,,,Incorrect IMDb ID.,,,,,
Monster,2003,R,30 Jan 2004,109 min,"Biography, Crime, Drama",Patty Jenkins,Patty Jenkins,"Charlize Theron, Christina Ricci, Bruce Dern","Based on the life of Aileen Wuornos, a Daytona Beach prostitute who became a serial killer.",English,"United States, Germany",Won 1 Oscar. 31 wins & 26 nominations total,https://m.media-amazon.com/images/M/MV5BMTI4NzI5NzEwNl5BMl5BanBnXkFtZTcwNjc1NjQyMQ@@._V1_SX300.jpg,74,7.3,"170,080",tt0340855,movie,N/A,"$34,469,210",N/A,N/A,True,7.3/10,74/100,,81%,,,,
Monster,2020,N/A,29 Jul 2020,70 min,"Adventure, Sci-Fi, Thriller",Clay Moffatt,Clay Moffatt,"Mackenzie Clark, Matt Conklin, Wesley Courtnay","A pair of college roommates find a mysterious camera and strange things begin to happen around them. As things start to worsen a scientist claiming to know the truth shows up. However, what he knows is only the tip of the iceberg.",English,United States,N/A,https://m.media-amazon.com/images/M/MV5BNzNhMjU0MDAtMmU5MC00M2MwLThhNTYtN2VkNTFlNDVlMjE3XkEyXkFqcGdeQXVyNTk4MjE5MjY@._V1_SX300.jpg,N/A,3.5,41,tt12260412,movie,N/A,N/A,N/A,N/A,True,3.5/10,,,,,,,
Monster,2008,Not Rated,18 Jan 2008,86 min,"Action, Adventure, Horror, Sci-Fi, Thriller",Eric Forsberg,"Eric Forsberg (story), David Michael Latt (story), David Michael Latt","Erin Evans, Sarah Lieving, Justin L. Jones, Kazuyuki Okada","After a massive earthquake in Tokyo, two American filmmakers document the true cause of the destruction.",English,USA,N/A,https://m.media-amazon.com/images/M/MV5BMTQ2NjIxNTg5N15BMl5BanBnXkFtZTcwNzE0NzAzOA@@._V1_SX300.jpg,N/A,2.1,"1,389",tt1148277,movie,N/A,N/A,N/A,N/A,True,2.1/10,,,,,,,
Monster,2018,N/A,01 Nov 2018,90 min,Horror,Matt Shaw,"Matt Shaw, Shaun Hutson, Michael Bray","Justin Hayward, Clair Buckley, Danielle Harold","Based on the best-selling book of the same name, MONSTER tells the harrowing tale of Richard, Mary and Andrew - a family of three. On the outside, Mary and Richard appear normal and their son, a deformed hulk of a 7 foot monster r...",English,United Kingdom,N/A,https://m.media-amazon.com/images/M/MV5BZWEzZDI2OTgtNjA2NC00OTRkLTg5Y2EtMmRiODdjMWFmMGY4XkEyXkFqcGc@._V1_SX300.jpg,N/A,5.3,197,tt6840904,movie,N/A,N/A,N/A,N/A,True,5.3/10,,,68%,,,,
Monster,2018,Unrated,07 May 2021,98 min,"Crime, Drama",Anthony Mandler,"Colen C. Wiley, Janece Shaffer, Walter Dean Myers","A$AP Rocky, John David Washington, Kelvin Harrison Jr.","A smart, likeable, 17-year-old film student from Harlem sees his world turned upside down when he's charged with a murder. We follow his dramatic journey through a complex legal battle.",English,United States,1 nomination total,https://m.media-amazon.com/images/M/MV5BNWE2Zjk1YjAtNWFiNi00Y2ZkLThlZjItNzZmYzc3NWIzMDVhXkEyXkFqcGc@._V1_SX300.jpg,56,6.5,"6,832",tt2850272,movie,N/A,N/A,N/A,N/A,True,6.5/10,56/100,,68%,,,,
Monster,2016,N/A,01 May 2016,5 min,"Animation, Short, Horror, Thriller",Montana Hall,N/A,N/A,A girl walks home at night and has to come face-to-face with the monsters lurking in the darkness.,English,USA,1 win.,N/A,N/A,N/A,N/A,tt6557210,movie,N/A,N/A,N/A,N/A,True,,,,,,,,
Next Goal Wins,2014,Not Rated,09 May 2014,97 min,"Documentary, Sport","Mike Brett, Steve Jamison",N/A,"Li'atama Amisone Jr., Faiivae Iuli Alex Godinet, D'Angelo Herrera","The American Samoa soccer team, deemed ""worst in the world"", try to qualify for the 2014 World Cup.","Samoan, English",United Kingdom,2 wins & 3 nominations,https://m.media-amazon.com/images/M/MV5BMjI3ODcxOTExNl5BMl5BanBnXkFtZTgwOTU0NTg1MTE@._V1_SX300.jpg,71,7.8,"3,206",tt2446600,movie,N/A,"$43,089",N/A,N/A,True,7.8/10,71/100,,100%,,,,
Thanksgiving,2023,R,17 Nov 2023,106 min,"Comedy, Horror, Mystery",Eli Roth,"Jeff Rendell, Eli Roth","Patrick Dempsey, Ty Olsson, Gina Gershon","After a Black Friday riot ends in tragedy, a mysterious Thanksgiving-inspired killer terrorizes Plymouth, Massachusetts, the birthplace of the infamous holiday.",English,"United States, Canada, Australia",1 win & 15 nominations total,https://m.media-amazon.com/images/M/MV5BYzhiZTkyM2UtNjU2MC00MjcxLWJhZGYtODQ0MDViN2UxMzAwXkEyXkFqcGc@._V1_SX300.jpg,63,6.2,"76,172",tt1448754,movie,N/A,"$31,908,884",N/A,N/A,True,6.2/10,63/100,,83%,,,,
Trolls Band Together,2023,PG,17 Nov 2023,91 min,"Animation, Adventure, Comedy","Walt Dohrn, Tim Heitz","Elizabeth Tippet, Thomas Dam","Anna Kendrick, Justin Timberlake, Kenan Thompson","As they grow closer, Poppy discovers that Branch was once part of her favorite boy band phenomenon, BroZone, with his four brothers. When one of them, Floyd, is kidnapped by villains, Branch and Poppy embark on a journey to rescue...","English, Spanish","United States, United Kingdom",5 wins & 6 nominations total,https://m.media-amazon.com/images/M/MV5BY2EzNTY0N2MtMTAyZS00ZTIwLTk5MmUtNWJhMmIwYmM5OWFiXkEyXkFqcGc@._V1_SX300.jpg,53,6.0,"19,119",tt14362112,movie,N/A,"$103,270,155",N/A,N/A,True,6.0/10,53/100,,64%,,,,
Thanksgiving,2006,N/A,04 Dec 2006,10 min,"Short, Horror",Scott Ennis,"Scott Ennis, Jason Fink, David Goulart","Eric Arbour, Holly Fink, Jason Fink","On a day when everyone is giving thanks, four friends sat down for Thanksgiving dinner. With a knock at the door, the young couples thought they were helping another person in need, but instead found themselves living a horrific expe",English,United States,N/A,https://m.media-amazon.com/images/M/MV5BMTAzMTM0Nzg1MDFeQTJeQWpwZ15BbWU3MDQ1MDIyNDE@._V1_SX300.jpg,N/A,7.0,68,tt0948471,movie,N/A,N/A,N/A,N/A,True,7.0/10,,,,,,,
Thanksgiving,2014,Not Rated,16 Nov 2023,85 min,"Comedy, Drama",Adam Newport-Berra,"Matthew Chastain, Adam Newport-Berra","Matthew Chastain, Benjamin Dickinson, Samantha Jacober","It's Thanksgiving, and Amy and Alex are in love. But when a mysterious stranger, introduced as Amy's estranged brother, shows up to dinner, Alex has his suspicions that this man may be someone altogether different.",English,United States,N/A,https://m.media-amazon.com/images/M/MV5BMjE1MDYxMDExOV5BMl5BanBnXkFtZTgwODcyNzUxMjE@._V1_SX300.jpg,N/A,4.5,42,tt2786266,movie,N/A,N/A,N/A,N/A,True,4.5/10,,,,,,,
Ko-Ko's Thanksgiving,1925,TV-G,21 Nov 1925,8 min,"Animation, Short, Comedy",Dave Fleischer,N/A,Max Fleischer,"At the studio Thanksgiving dinner, Ko-Ko plays a home movie reel showing clips of his wildest pranks on ""The Boss"" from previous ""Out of the Inkwell"" films.",None,United States,N/A,https://m.media-amazon.com/images/M/MV5BYjRmMDBhOGQtOGViOS00YWU3LThhNDctOGMzZmQwMzMyZjczXkEyXkFqcGdeQXVyMTM3MTY5NDM0._V1_SX300.jpg,N/A,6.2,31,tt0015996,movie,N/A,N/A,N/A,N/A,True,6.2/10,,,,,,,
,,,,,,,,,,,,,,,,,,,,,,,False,,,Incorrect IMDb ID.,,,,,
,,,,,,,,,,,,,,,,,,,,,,,False,,,Incorrect IMDb ID.,,,,,
,,,,,,,,,,,,,,,,,,,,,,,False,,,Incorrect IMDb ID.,,,,,
Next Goal Wins,2023,PG-13,17 Nov 2023,104 min,"Comedy, Drama, Sport",Taika Waititi,"Taika Waititi, Iain Morris","Michael Fassbender, Oscar Kightley, Kaimana","The story of the infamously terrible American Samoa soccer team, known for a brutal 2001 FIFA match they lost 31-0.","English, Samoan, French, Swahili","United Kingdom, United States, New Zealand",1 nomination total,https://m.media-amazon.com/images/M/MV5BYThhZjU4MTYtNDI5Ni00NTE0LTk2NjUtZmZhMGFiNDhiNDM4XkEyXkFqcGc@._V1_SX300.jpg,44,6.5,"29,172",tt10767052,movie,N/A,"$6,713,826",N/A,N/A,True,6.5/10,44/100,,46%,,,,
Dream Scenario,2023,R,22 Nov 2023,102 min,"Comedy, Drama, Fantasy",Kristoffer Borgli,Kristoffer Borgli,"Lily Bird, Nicolas Cage, Julianne Nicholson",An ordinary family man finds his life turned upside down when strangers suddenly start seeing him in their dreams.,"English, French","United States, Canada",3 wins & 18 nominations total,https://m.media-amazon.com/images/M/MV5BZTVhZjNhMzktOGQ2YS00OGVkLWExNGEtMjBlYWI3MjVmYmM1XkEyXkFqcGc@._V1_SX300.jpg,74,6.8,"87,750",tt21942866,movie,N/A,"$5,742,193",N/A,N/A,True,6.8/10,74/100,,91%,,,,
Journey to Bethlehem,2023,PG,10 Nov 2023,99 min,"Adventure, Family, Musical",Adam Anders,"Adam Anders, Peter Barsocchini","Fiona Palomo, Milo Manheim, Antonio Banderas","This live-action Christmas musical adventure for the entire family weaves classic Christmas melodies with humor, faith, and new pop songs in a retelling of the greatest story ever told: the story of Mary and Joseph and the birth o...","English, French","United States, Spain",3 nominations total,https://m.media-amazon.com/images/M/MV5BYTU5NmUyNzctMTcyMC00YzdiLTg5ZWEtZjY0NmZjYWM4NGM5XkEyXkFqcGc@._V1_SX300.jpg,N/A,6.4,"3,398",tt13848804,movie,N/A,"$6,820,796",N/A,N/A,True,6.4/10,,,74%,,,,
At the Gates,2022,R,22 Sep 2023,97 min,"Drama, Mystery, Thriller",Augustus Meleo Bernstein,Augustus Meleo Bernstein,"Ezekiel Pacheco, Sadie Stanley, Christopher Alvarenga","A housekeeper from El Salvador brings her son to help her clean an affluent family's Los Angeles home. After being told by her employers that immigration officers are searching for her, she accepts the invitation to shelter in the...","English, Spanish",United States,3 wins & 2 nominations,https://m.media-amazon.com/images/M/MV5BYmFkNzdkOGUtNDIwZS00MmZlLWI3MzItNWQ0NjNjYjg0ZWMyXkEyXkFqcGc@._V1_SX300.jpg,N/A,6.9,84,tt17372926,movie,N/A,"$7,552",N/A,N/A,True,6.9/10,,,64%,,,,
All Dirt Roads Taste of Salt,2023,PG,22 Dec 2023,92 min,Drama,Raven Jackson,Raven Jackson,"Kaylee Nicole Johnson, Chris Chalk, Jayah Henry",A decades-spanning exploration of a woman's life in Mississippi.,English,United States,6 wins & 21 nominations total,https://m.media-amazon.com/images/M/MV5BY2M4MDlkZWYtZWU4Ny00ZDk3LWI1NDUtYzU3NjZkNGI5MTk2XkEyXkFqcGc@._V1_SX300.jpg,87,5.9,"1,221",tt11534720,movie,N/A,"$52,084",N/A,N/A,True,5.9/10,87/100,,90%,,,,
After Death,2012,Not Rated,21 Jan 2014,104 min,"Comedy, Drama, Mystery",Martin Gooch,Martin Gooch,"Claira Watson Parr, Ben Shockley, David Wayman","Following the sudden death of their last surviving parent - their Dad, two brothers and two sisters return to the family home after many years to face each other, face facts and face the future. But what do they know of the past?",English,United Kingdom,N/A,https://m.media-amazon.com/images/M/MV5BMzAxNzA2NzMxOF5BMl5BanBnXkFtZTcwMjAyMTc5Nw@@._V1_SX300.jpg,N/A,3.8,285,tt1822203,movie,N/A,N/A,N/A,N/A,True,3.8/10,,,,,,,
After Death,2023,PG-13,27 Oct 2023,108 min,Documentary,"Stephen Gray, Chris Radtke",Stephen Gray,"Dale Black, Dean Braxton, John Burke","Based on real near-death experiences, After Death explores the afterlife with the guidance of New York Times bestselling authors, medical experts, scientists, and survivors that shed a light on what awaits us.",English,United States,2 nominations total,https://m.media-amazon.com/images/M/MV5BZjVkYzE3NGEtZjFhYS00OWY2LWE4ZTYtOGRlZGI1NjQ2MjYyXkEyXkFqcGc@._V1_SX300.jpg,28,6.3,"1,960",tt21191906,movie,N/A,"$11,478,326",N/A,N/A,True,6.3/10,28/100,,47%,,,,
Freelance,1970,Not Rated,N/A,91 min,Crime,Francis Megahy,"Bernie Cooper, Francis Megahy","Ian McShane, Gayle Hunnicutt, Keith Barron","A small time London con-artist witnesses a gangland hit. Determined to carry out his schemes, he must do so while avoiding the same hit-man.",English,"United Kingdom, Canada",N/A,https://m.media-amazon.com/images/M/MV5BNzA5ZGY4ZjMtYzg4NS00YTIzLWFiZGItYjBjMDQ5MDE5ZDM3XkEyXkFqcGdeQXVyMTQxNzMzNDI@._V1_SX300.jpg,N/A,6.9,110,tt0103998,movie,N/A,N/A,N/A,N/A,True,6.9/10,,,,,,,
FreeLance,2007,N/A,01 Mar 2007,63 min,Comedy,Drew Sawyer,Sean Mann,"Bob Kunkel, Sean Mann, Jackson Williamson","Elliot Guillespsie dreams of being the worlds greatest investigative reporter, ala his idol, Rod Reel. A daunting task considering he is both camera man and reporter, can't drive, and still lives in his mother's basement. Further ...",English,United States,N/A,https://m.media-amazon.com/images/M/MV5BMjAyMjk3MjA5N15BMl5BanBnXkFtZTgwNTQ4NzgzMTE@._V1_SX300.jpg,N/A,7.0,13,tt1074961,movie,N/A,N/A,N/A,N/A,True,7.0/10,,,,,,,
Freelance,2023,R,27 Oct 2023,108 min,"Action, Comedy",Pierre Morel,Jacob Lentz,"John Cena, Alison Brie, Juan Pablo Raba","An ex-special forces operative takes a job to provide security for a journalist as she interviews a dictator, but when a military coup breaks out in the middle of the interview, they are forced to escape into the jungle.","English, Spanish, Quechua, Afrikaans, French","United States, Colombia, United Kingdom",N/A,https://m.media-amazon.com/images/M/MV5BMDcwYzM1YTEtYmU3YS00YjAzLTg1OGMtZjZmOWVhNTUyMmUxXkEyXkFqcGc@._V1_SX300.jpg,26,5.6,"27,998",tt15744298,movie,N/A,"$5,314,136",N/A,N/A,True,5.6/10,26/100,,10%,,,,
Freelance,2022,N/A,N/A,N/A,"Short, Horror",Mike Gerbino,Mike Gerbino,"Zahra Alzubaidi, Renee Gagner, Charlie Reid","When a down-on-her-luck video editor accepts a mysterious offer to edit snuff films, she finds herself haunted by the victim in the footage.",English,United States,N/A,https://m.media-amazon.com/images/M/MV5BMDQ4YzFiYjItY2I4Mi00MTNjLThiMWYtOWFmM2RjYTUzYWIzXkEyXkFqcGdeQXVyNjExNjAxMzc@._V1_SX300.jpg,N/A,N/A,N/A,tt16899796,movie,N/A,N/A,N/A,N/A,True,,,,,,,,
Freelance,2024,N/A,12 Oct 2024,110 min,Thriller,John Balazs,Mike Gerbino,"Nicole Pastor, Jordan Fraser-Trumble, Stephen Degenaro","When a down-on-her luck video editor takes on a mysterious, well-paying job cutting snuff films, she is haunted by visions of the people in her videos.",English,Australia,N/A,https://m.media-amazon.com/images/M/MV5BODY3YzUwNDUtYjk0My00ZmU3LTk5Y2EtZjFmY2ZkMTI1ZjVmXkEyXkFqcGc@._V1_SX300.jpg,N/A,8.4,18,tt27634066,movie,N/A,N/A,N/A,N/A,True,8.4/10,,,100%,,,,
Priscilla,2023,R,03 Nov 2023,113 min,"Biography, Drama, Music",Sofia Coppola,"Priscilla Presley, Sandra Harmon, Sofia Coppola","Cailee Spaeny, Jacob Elordi, Ari Cohen","When teenage Priscilla Beaulieu meets Elvis Presley, the man who is already a meteoric rock-and-roll superstar becomes someone entirely unexpected in private moments: a thrilling crush, an ally in loneliness, a vulnerable best fri...","English, French","Italy, United States, United Kingdom",6 wins & 35 nominations total,https://m.media-amazon.com/images/M/MV5BOWRjYjVhYWUtNjM2OS00OWE1LTk5ZmYtZDM3MjllNzI1ZmQ4XkEyXkFqcGc@._V1_SX300.jpg,79,6.5,"49,254",tt22041854,movie,N/A,"$20,960,939",N/A,N/A,True,6.5/10,79/100,,84%,,,,
The Domino Revival,2023,PG-13,24 Oct 2023,125 min,Documentary,Mike Signorelli,Mike Signorelli,"Mark Driscoll, Alexander Pagani, Isaiah Saldivar",It takes audiences on a special journey with Mike Signorelli and the revivalists to a pivotal time in the country's history.,English,United States,N/A,https://m.media-amazon.com/images/M/MV5BMmZjYzc1MmEtNzYzZi00NzA3LWIyNjUtNmMzYTE2YTU2OTFlXkEyXkFqcGc@._V1_SX300.jpg,N/A,6.1,511,tt28088015,movie,N/A,"$851,398",N/A,N/A,True,6.1/10,,,,,,,
Beyond Utopia,2023,PG-13,28 Nov 2023,115 min,"Documentary, Biography, History",Madeleine Gavin,N/A,"Hyeonseo Lee, Sung-eun Kim, So-yeon Lee","The story of several families as they attempt to escape oppression in North Korea, revealing a world most of us have never seen.","English, Korean","United States, United Kingdom",Nominated for 1 Primetime Emmy. 7 wins & 48 nominations total,https://m.media-amazon.com/images/M/MV5BMDVjMmE4NWEtN2RiOS00ZGFlLThjMTctN2I2YWNmM2NiNDY5XkEyXkFqcGc@._V1_SX300.jpg,85,7.9,"4,580",tt25470468,movie,N/A,"$11,716",N/A,N/A,True,7.9/10,85/100,,100%,,,,
Killers of the Flower Moon,2023,R,20 Oct 2023,206 min,"Crime, Drama, History",Martin Scorsese,"Eric Roth, Martin Scorsese, David Grann","Leonardo DiCaprio, Robert De Niro, Lily Gladstone","When oil is discovered in 1920s Oklahoma under Osage Nation land, the Osage people are murdered one by one - until the FBI steps in to unravel the mystery.","English, Osage, Latin, French",United States,Nominated for 10 Oscars. 136 wins & 424 nominations total,https://m.media-amazon.com/images/M/MV5BZWY5ZDVjNTUtODI5Yy00MjFhLWEyM2EtYzZjM2VjZTI0MTBjXkEyXkFqcGc@._V1_SX300.jpg,89,7.5,"291,667",tt5537002,movie,N/A,"$68,035,488",N/A,N/A,True,7.5/10,89/100,,93%,,,,
The Persian Version,2023,R,05 Dec 2023,107 min,"Comedy, Drama, Romance",Maryam Keshavarz,Maryam Keshavarz,"Layla Mohammadi, Niousha Noor, Kamand Shafieisabet","When a large Iranian-American family gathers, a family secret is uncovered that catapults the estranged mother and daughter into an exploration of the past, and to discover they are more alike than they know.","English, Persian",United States,4 wins & 5 nominations total,https://m.media-amazon.com/images/M/MV5BOTFlYTExZDctOGY4OS00MDY3LTk2NjYtMTE2ZjIzMDFmMWRiXkEyXkFqcGc@._V1_SX300.jpg,61,6.2,"4,390",tt24076146,movie,N/A,"$559,820",N/A,N/A,True,6.2/10,61/100,,84%,,,,
The Mission,1986,PG,31 Oct 1986,125 min,"Adventure, Drama, History",Roland Joffé,Robert Bolt,"Robert De Niro, Jeremy Irons, Ray McAnally",Eighteenth-century Spanish Jesuits try to protect a remote South American tribe in danger of falling under the rule of pro-slavery Portugal.,"English, Guarani, Spanish, Latin","United Kingdom, France, United States",Won 1 Oscar. 15 wins & 27 nominations total,https://m.media-amazon.com/images/M/MV5BODcxMDJiMzQtNzVkYS00ZDI3LWEzYmEtY2NiYTIzZWQzYzRlXkEyXkFqcGc@._V1_SX300.jpg,55,7.4,"69,335",tt0091530,movie,N/A,"$17,218,023",N/A,N/A,True,7.4/10,55/100,,63%,,,,
The Mission,1997,N/A,N/A,74 min,Documentary,Clive Gordon,N/A,N/A,"Deep in the Ugandan bush, an Italian nun tries to get back 30 of her convent school girls who have been abducted for sex by an army of children led by a mystic claiming to be the son of God.",English,United Kingdom,N/A,N/A,N/A,N/A,N/A,tt0385095,movie,N/A,N/A,N/A,N/A,True,,,,,,,,
The Mission,1906,N/A,N/A,N/A,"Documentary, Short",Jack Frawley,N/A,N/A,N/A,"None, English",USA,N/A,N/A,N/A,4.1,13,tt3441556,movie,N/A,N/A,N/A,N/A,True,4.1/10,,,,,,,
The Mission,2023,PG-13,08 Dec 2023,103 min,Documentary,"Amanda McBaine, Jesse Moss","Amanda McBaine, Jesse Moss","Pam Arlund, Dan Davis, Levi Davis","26-year-old American missionary John Chau was killed as he attempted to make contact with an Indigenous group off the coast of India, one of the last communities on the planet still living in isolation.",English,United States,11 nominations,https://m.media-amazon.com/images/M/MV5BNDMxZmRkOGMtYTRlMC00ZGY4LThiZTMtOGU4ZGIzYjUzMDAzXkEyXkFqcGc@._V1_SX300.jpg,N/A,6.4,"1,075",tt28097834,movie,N/A,"$58,377",N/A,N/A,True,6.4/10,,,94%,,,,
,,,,,,,,,,,,,,,,,,,,,,,False,,,Incorrect IMDb ID.,,,,,
Dicks: The Musical,2023,R,20 Oct 2023,86 min,"Comedy, Musical",Larry Charles,"Aaron Jackson, Josh Sharp","Josh Sharp, Aaron Jackson, Nathan Lane",A pair of business rivals discover that they're identical twins and decide to swap places in an attempt to trick their divorced parents to get back together.,English,United States,1 win & 5 nominations,https://m.media-amazon.com/images/M/MV5BMWFjYjJjMDYtZjY2Yi00YzJmLWFmYTQtN2NjZWUwNGQ4ZTkzXkEyXkFqcGc@._V1_SX300.jpg,N/A,5.3,"3,573",tt7130916,movie,N/A,"$1,453,012",N/A,N/A,True,5.3/10,,,68%,,,,
The Royal Hotel,2023,R,06 Oct 2023,91 min,Drama,Kitty Green,"Kitty Green, Oscar Redding","Julia Garner, Jessica Henwick, Herbert Nordrum",Backpackers Hanna and Liv take a job in a remote Australian pub for some extra cash and are confronted with a bunch of unruly locals and a situation that rapidly leaps out of their control.,English,"Australia, United Kingdom, United States",4 wins & 22 nominations total,https://m.media-amazon.com/images/M/MV5BNDIxNDZmNjUtYjM5YS00NGJjLTlhZjctNGEyODU3MmJjZGJmXkEyXkFqcGc@._V1_SX300.jpg,77,5.7,"16,101",tt18363072,movie,N/A,"$780,263",N/A,N/A,True,5.7/10,77/100,,89%,,,,
She Came to Me,2023,R,12 Oct 2023,102 min,"Comedy, Drama, Music",Rebecca Miller,Rebecca Miller,"Peter Dinklage, Anne Hathaway, Marisa Tomei",A composer who suffers writer's block rediscovers his passion after an adventurous one-night stand.,English,United States,2 nominations total,https://m.media-amazon.com/images/M/MV5BMjNiOGUxYWItMTQ4MC00Yzk1LThlNTQtNDMwYjNmZGE5NDFmXkEyXkFqcGc@._V1_SX300.jpg,53,6.0,"7,851",tt6689014,movie,N/A,"$733,978",N/A,N/A,True,6.0/10,53/100,,48%,,,,
The Exorcist: Believer,2023,R,06 Oct 2023,111 min,Horror,David Gordon Green,"Peter Sattler, David Gordon Green, Scott Teems","Lafortune Joseph, Leslie Odom Jr., Gastner Legerme","When two girls disappear into the woods and return three days later with no memory of what happened to them, the father of one girl seeks out Chris MacNeil, who's been forever altered by what happened to her daughter fifty years ago.","English, Latin, Haitian, French",United States,1 win & 22 nominations total,https://m.media-amazon.com/images/M/MV5BYjMxN2E4NTctYjYxZi00OTM5LTk3YTAtZmI0MjljN2VhNmY5XkEyXkFqcGc@._V1_SX300.jpg,39,4.8,"47,888",tt12921446,movie,N/A,"$65,537,395",N/A,N/A,True,4.8/10,39/100,,22%,,,,
PAW Patrol: The Mighty Movie,2023,PG,29 Sep 2023,88 min,"Animation, Action, Adventure",Cal Brunker,"Cal Brunker, Bob Barlen, Shane Morris","Dan Duran, Kristen Bell, James Marsden","A magical meteor falls in Adventure City and gives the PAW Patrol superpowers, transforming them into the Mighty Pups. But they face their most powerful challenge when Humdinger teams up with a mad scientist to steal their powers.",English,"Canada, United States",1 win & 8 nominations total,https://m.media-amazon.com/images/M/MV5BZTM3NWM4ZTUtYjNhMC00Mzg1LWFmM2QtNGQ0NDg1NzkzYWY4XkEyXkFqcGc@._V1_SX300.jpg,49,5.9,"6,292",tt15837338,movie,N/A,"$65,343,309",N/A,N/A,True,5.9/10,49/100,,72%,,,,
The Creator,2020,N/A,20 Nov 2020,5 min,"Short, Drama, Sci-Fi",Sergiy Pudich,"Rouman Kang, George Muse, Sergiy Pudich","Ronel Stander, George Muse, Myra Mala","The scientist creating and training androids to be perfect in different skills: fighting, athletics, dancing, and. - painting. All droids improving themselves day by day, but an artistic one is standing where she was - Will Creato...",English,"Ukraine, China",3 wins & 3 nominations,https://m.media-amazon.com/images/M/MV5BYmUzYmM3ODEtOTdjYi00N2Q4LTgxZmMtMGJlM2I1ZWI3Mjk4XkEyXkFqcGdeQXVyNjU3NjI1NzA@._V1_SX300.jpg,N/A,N/A,7,tt13654330,movie,N/A,N/A,N/A,N/A,True,,,,,,,,
The Creator,2023,PG-13,29 Sep 2023,133 min,"Action, Adventure, Drama",Gareth Edwards,"Gareth Edwards, Chris Weitz","John David Washington, Madeleine Yuna Voyles, Gemma Chan","Against the backdrop of a war between humans and robots with artificial intelligence, a former soldier finds the robots' secret weapon to end the conflict, an AI in the form of a child.","English, Thai","United States, Cambodia, Japan",Nominated for 2 Oscars. 13 wins & 49 nominations total,https://m.media-amazon.com/images/M/MV5BMDkxMTUxOTQtYzM4Yi00YzA2LTgzOTYtNDg2NTliODE0ZTRjXkEyXkFqcGc@._V1_SX300.jpg,63,6.7,"190,980",tt11858890,movie,N/A,"$40,774,679",N/A,N/A,True,6.7/10,63/100,,67%,,,,
